{"componentChunkName":"component---src-pages-accomodations-for-students-with-adhd-mdx-slug-js","path":"/accomodations-for-students-with-adhd/ieps-and-504s/","result":{"data":{"mdx":{"frontmatter":{"title":"IEPs and 504s: Qualify for Services","chapter":310,"keywords":"ieps and 504s, accomodations for adhd, accomodations for students with adhd, accommodations for adhd elementary students","publish":"June 18, 2022","update":"June 18, 2022","short":"\nWhich one makes sense for us? "},"slug":"ieps-and-504s","body":"var _excluded = [\"components\"];\n\nfunction _extends() { _extends = Object.assign ? Object.assign.bind() : function (target) { for (var i = 1; i < arguments.length; i++) { var source = arguments[i]; for (var key in source) { if (Object.prototype.hasOwnProperty.call(source, key)) { target[key] = source[key]; } } } return target; }; return _extends.apply(this, arguments); }\n\nfunction _objectWithoutProperties(source, excluded) { if (source == null) return {}; var target = _objectWithoutPropertiesLoose(source, excluded); var key, i; if (Object.getOwnPropertySymbols) { var sourceSymbolKeys = Object.getOwnPropertySymbols(source); for (i = 0; i < sourceSymbolKeys.length; i++) { key = sourceSymbolKeys[i]; if (excluded.indexOf(key) >= 0) continue; if (!Object.prototype.propertyIsEnumerable.call(source, key)) continue; target[key] = source[key]; } } return target; }\n\nfunction _objectWithoutPropertiesLoose(source, excluded) { if (source == null) return {}; var target = {}; var sourceKeys = Object.keys(source); var key, i; for (i = 0; i < sourceKeys.length; i++) { key = sourceKeys[i]; if (excluded.indexOf(key) >= 0) continue; target[key] = source[key]; } return target; }\n\n/* @jsxRuntime classic */\n\n/* @jsx mdx */\nvar _frontmatter = {\n  \"title\": \"IEPs and 504s: Qualify for Services\",\n  \"chapter\": 310,\n  \"publish\": \"2022-06-18\",\n  \"update\": \"2022-06-18\",\n  \"hero_image\": \"./media/504_plan_or_iep.png\",\n  \"hero_alt\": \"Why an IEP May Be Better Than a 504 Plan for Your ADHD Elementary Student\",\n  \"author\": \"Rho Lall\",\n  \"keywords\": \"ieps and 504s, accomodations for adhd, accomodations for students with adhd, accommodations for adhd elementary students\",\n  \"short\": \"\\nWhich one makes sense for us? \"\n};\nvar layoutProps = {\n  _frontmatter: _frontmatter\n};\nvar MDXLayout = \"wrapper\";\nreturn function MDXContent(_ref) {\n  var components = _ref.components,\n      props = _objectWithoutProperties(_ref, _excluded);\n\n  return mdx(MDXLayout, _extends({}, layoutProps, props, {\n    components: components,\n    mdxType: \"MDXLayout\"\n  }), mdx(\"blockquote\", null, mdx(\"p\", {\n    parentName: \"blockquote\"\n  }, \"In these days, it is doubtful that any child may reasonably be expected to succeed in life if \", \"[s/]\", \"he is denied the opportunity of an education. Such an opportunity is a right that must be made available to all on equal terms. ~ The Supreme Court (in Brown VS Board of Education), 1954\")), mdx(\"p\", null, \"In many cases, Section 504 children are eligible for services under IDEA. In this section, you will learn about Section 504 of the Rehabilitation Act (and the Americans with Disabilities Act), in contrast to the Individuals with Disabilities Act (IDEA). The shorthand between IEPs & 504s comes down to two words: accommodations vs specialized education. \"), mdx(\"p\", null, \"If your child simply needs accommodations in order to access the general education curriculum then a 504 will be implemented. If however the general education curriculum is insufficient and your child requires specialized education then an IEP is appropriate.\"), mdx(\"p\", null, \"Don't use the term \\\"accommodations for ADHD\\\" when specialized education is appropriate. You may inadvertently pigeonhole your child into a 504 plan when an IEP is warranted.\"), mdx(\"h2\", {\n    \"id\": \"what-is-an-iep\",\n    \"style\": {\n      \"position\": \"relative\"\n    }\n  }, mdx(\"a\", {\n    parentName: \"h2\",\n    \"href\": \"#what-is-an-iep\",\n    \"aria-label\": \"what is an iep permalink\",\n    \"className\": \"anchor before\"\n  }, mdx(\"svg\", {\n    parentName: \"a\",\n    \"aria-hidden\": \"true\",\n    \"focusable\": \"false\",\n    \"height\": \"16\",\n    \"version\": \"1.1\",\n    \"viewBox\": \"0 0 16 16\",\n    \"width\": \"16\"\n  }, mdx(\"path\", {\n    parentName: \"svg\",\n    \"fillRule\": \"evenodd\",\n    \"d\": \"M4 9h1v1H4c-1.5 0-3-1.69-3-3.5S2.55 3 4 3h4c1.45 0 3 1.69 3 3.5 0 1.41-.91 2.72-2 3.25V8.59c.58-.45 1-1.27 1-2.09C10 5.22 8.98 4 8 4H4c-.98 0-2 1.22-2 2.5S3 9 4 9zm9-3h-1v1h1c1 0 2 1.22 2 2.5S13.98 12 13 12H9c-.98 0-2-1.22-2-2.5 0-.83.42-1.64 1-2.09V6.25c-1.09.53-2 1.84-2 3.25C6 11.31 7.55 13 9 13h4c1.45 0 3-1.69 3-3.5S14.5 6 13 6z\"\n  }))), \"What is an IEP?\"), mdx(\"p\", null, \"An IEP, or Individualized Education Program, is a document that outlines the specific educational needs of a student with disabilities. If your child has an IEP, it means they receive specialized education services. This can include extra time on tests, assistive technology, and modifications to the general curriculum.\"), mdx(\"h2\", {\n    \"id\": \"what-is-a-504-plan\",\n    \"style\": {\n      \"position\": \"relative\"\n    }\n  }, mdx(\"a\", {\n    parentName: \"h2\",\n    \"href\": \"#what-is-a-504-plan\",\n    \"aria-label\": \"what is a 504 plan permalink\",\n    \"className\": \"anchor before\"\n  }, mdx(\"svg\", {\n    parentName: \"a\",\n    \"aria-hidden\": \"true\",\n    \"focusable\": \"false\",\n    \"height\": \"16\",\n    \"version\": \"1.1\",\n    \"viewBox\": \"0 0 16 16\",\n    \"width\": \"16\"\n  }, mdx(\"path\", {\n    parentName: \"svg\",\n    \"fillRule\": \"evenodd\",\n    \"d\": \"M4 9h1v1H4c-1.5 0-3-1.69-3-3.5S2.55 3 4 3h4c1.45 0 3 1.69 3 3.5 0 1.41-.91 2.72-2 3.25V8.59c.58-.45 1-1.27 1-2.09C10 5.22 8.98 4 8 4H4c-.98 0-2 1.22-2 2.5S3 9 4 9zm9-3h-1v1h1c1 0 2 1.22 2 2.5S13.98 12 13 12H9c-.98 0-2-1.22-2-2.5 0-.83.42-1.64 1-2.09V6.25c-1.09.53-2 1.84-2 3.25C6 11.31 7.55 13 9 13h4c1.45 0 3-1.69 3-3.5S14.5 6 13 6z\"\n  }))), \"What is a 504 Plan?\"), mdx(\"p\", null, \"Under Section 504, your child may receive accommodations and modifications that are not available to children who do not have a disability. Section 504 states that a student cannot be excluded from participating in, be denied the benefit of, or be subjected to discrimination under any program or activity receiving Federal financial assistance on the basis of their ADD/ADHD. A 504 plan is put in place by a school. It is not as formal as an IEP.\"), mdx(\"h2\", {\n    \"id\": \"whats-the-difference\",\n    \"style\": {\n      \"position\": \"relative\"\n    }\n  }, mdx(\"a\", {\n    parentName: \"h2\",\n    \"href\": \"#whats-the-difference\",\n    \"aria-label\": \"whats the difference permalink\",\n    \"className\": \"anchor before\"\n  }, mdx(\"svg\", {\n    parentName: \"a\",\n    \"aria-hidden\": \"true\",\n    \"focusable\": \"false\",\n    \"height\": \"16\",\n    \"version\": \"1.1\",\n    \"viewBox\": \"0 0 16 16\",\n    \"width\": \"16\"\n  }, mdx(\"path\", {\n    parentName: \"svg\",\n    \"fillRule\": \"evenodd\",\n    \"d\": \"M4 9h1v1H4c-1.5 0-3-1.69-3-3.5S2.55 3 4 3h4c1.45 0 3 1.69 3 3.5 0 1.41-.91 2.72-2 3.25V8.59c.58-.45 1-1.27 1-2.09C10 5.22 8.98 4 8 4H4c-.98 0-2 1.22-2 2.5S3 9 4 9zm9-3h-1v1h1c1 0 2 1.22 2 2.5S13.98 12 13 12H9c-.98 0-2-1.22-2-2.5 0-.83.42-1.64 1-2.09V6.25c-1.09.53-2 1.84-2 3.25C6 11.31 7.55 13 9 13h4c1.45 0 3-1.69 3-3.5S14.5 6 13 6z\"\n  }))), \"What's The Difference?\"), mdx(\"p\", null, \"IDEA ensures your child receives an individualized education program (IEP) that is designed to meet his or her unique needs to \", mdx(\"strong\", {\n    parentName: \"p\"\n  }, \"provide your child with educational benefit\"), \", so your child is prepared \\u201Cfor employment and independent living.\\u201D \"), mdx(\"p\", null, \"Section 504 does none of this. Section 504 does not secure an IEP for your child. Section 504 protects you (the parent) and your child from discrimination on the basis of your child\\u2019s ADHD. Section 504 is part of a civil rights law that protects individuals with disabilities (students) from discrimination related to their disability and guarantees equal access to general education.\"), mdx(\"p\", null, \"The difference is in \\u201CAccess\\u201D vs. \\u201CEducational Benefit\\u201D. Both laws (Section 504 & IDEA) refer to your child\\u2019s right to a free appropriate public education (FAPE). However, the standard is different under each law. \"), mdx(\"p\", null, \"Under Section 504, \\u201Cservices \\u2026 are designed to meet individual educational needs of a person with disabilities as adequately as the needs of a person without disabilities are met.\\u201D Under Section 504, your child simply has the right to access the same free appropriate public education that is available to all children. There is no guarantee to \\u201Cprovide your child with educational benefit\\u201D.\"), mdx(\"p\", null, \"IDEA\\u2019s standard recognizes that general education may not be sufficient for an ADHD elementary student due to complications from their ADHD. When this is the case IDEA outlines the development of an individualized education program (IEP) that must \\u201Cprovide your child with educational benefit.\\u201D\"), mdx(\"p\", null, \"Some parents and educators believe that under IDEA, the child must be placed in a special education class, but if the child has a 504 plan, the child may remain in the regular classroom. Parents are then counseled that a 504 plan is more desirable. This is simply not true. Under IDEA, \\u201Cspecial education\\u201D is a service, not a place or placement. The truth is a child with a Section 504 plan has fewer rights, protections, and access to services than a child with an IEP.\"), mdx(\"h2\", {\n    \"id\": \"qualifying-for-accommodations-for-adhd-thru-a-variety-of-assessment-tools\",\n    \"style\": {\n      \"position\": \"relative\"\n    }\n  }, mdx(\"a\", {\n    parentName: \"h2\",\n    \"href\": \"#qualifying-for-accommodations-for-adhd-thru-a-variety-of-assessment-tools\",\n    \"aria-label\": \"qualifying for accommodations for adhd thru a variety of assessment tools permalink\",\n    \"className\": \"anchor before\"\n  }, mdx(\"svg\", {\n    parentName: \"a\",\n    \"aria-hidden\": \"true\",\n    \"focusable\": \"false\",\n    \"height\": \"16\",\n    \"version\": \"1.1\",\n    \"viewBox\": \"0 0 16 16\",\n    \"width\": \"16\"\n  }, mdx(\"path\", {\n    parentName: \"svg\",\n    \"fillRule\": \"evenodd\",\n    \"d\": \"M4 9h1v1H4c-1.5 0-3-1.69-3-3.5S2.55 3 4 3h4c1.45 0 3 1.69 3 3.5 0 1.41-.91 2.72-2 3.25V8.59c.58-.45 1-1.27 1-2.09C10 5.22 8.98 4 8 4H4c-.98 0-2 1.22-2 2.5S3 9 4 9zm9-3h-1v1h1c1 0 2 1.22 2 2.5S13.98 12 13 12H9c-.98 0-2-1.22-2-2.5 0-.83.42-1.64 1-2.09V6.25c-1.09.53-2 1.84-2 3.25C6 11.31 7.55 13 9 13h4c1.45 0 3-1.69 3-3.5S14.5 6 13 6z\"\n  }))), \"Qualifying for Accommodations for ADHD thru A Variety of Assessment Tools\"), mdx(\"p\", null, \"Assessing eligibility for specialized education and accommodations for ADHD requires \", mdx(\"a\", {\n    parentName: \"p\",\n    \"href\": \"https://sites.ed.gov/idea/statute-chapter-33/subchapter-ii/1414/b/2/A\"\n  }, \"a variety of assessment tools and strategies\"), \" to gather information about your child's academic ability as well as functional and developmental ability. The scope of information gathering strategies at the school's disposal includes information provided by you, the parent. The school cannot rely on \", mdx(\"a\", {\n    parentName: \"p\",\n    \"href\": \"\"\n  }, \"any single measure or assessment as the sole criterion\"), \" for making a determination. The school must use a variety of technically sound instruments to assess the relative contribution of these factors: cognitive, behavioral, physical, and developmental.\"), mdx(\"h2\", {\n    \"id\": \"is-there-enough-data-to-determine-if-accommodations-for-adhd-are-necessary\",\n    \"style\": {\n      \"position\": \"relative\"\n    }\n  }, mdx(\"a\", {\n    parentName: \"h2\",\n    \"href\": \"#is-there-enough-data-to-determine-if-accommodations-for-adhd-are-necessary\",\n    \"aria-label\": \"is there enough data to determine if accommodations for adhd are necessary permalink\",\n    \"className\": \"anchor before\"\n  }, mdx(\"svg\", {\n    parentName: \"a\",\n    \"aria-hidden\": \"true\",\n    \"focusable\": \"false\",\n    \"height\": \"16\",\n    \"version\": \"1.1\",\n    \"viewBox\": \"0 0 16 16\",\n    \"width\": \"16\"\n  }, mdx(\"path\", {\n    parentName: \"svg\",\n    \"fillRule\": \"evenodd\",\n    \"d\": \"M4 9h1v1H4c-1.5 0-3-1.69-3-3.5S2.55 3 4 3h4c1.45 0 3 1.69 3 3.5 0 1.41-.91 2.72-2 3.25V8.59c.58-.45 1-1.27 1-2.09C10 5.22 8.98 4 8 4H4c-.98 0-2 1.22-2 2.5S3 9 4 9zm9-3h-1v1h1c1 0 2 1.22 2 2.5S13.98 12 13 12H9c-.98 0-2-1.22-2-2.5 0-.83.42-1.64 1-2.09V6.25c-1.09.53-2 1.84-2 3.25C6 11.31 7.55 13 9 13h4c1.45 0 3-1.69 3-3.5S14.5 6 13 6z\"\n  }))), \"Is there Enough Data To Determine If Accommodations for ADHD are necessary?\"), mdx(\"p\", null, \"The IEP Team and other qualified professionals, as appropriate review existing evaluation data on the child, including:\"), mdx(\"ul\", null, mdx(\"li\", {\n    parentName: \"ul\"\n  }, mdx(\"p\", {\n    parentName: \"li\"\n  }, \"evaluations and information provided by the parents of the child;\")), mdx(\"li\", {\n    parentName: \"ul\"\n  }, mdx(\"p\", {\n    parentName: \"li\"\n  }, \"current classroom-based, local, or State assessments, and classroom-based observations\")), mdx(\"li\", {\n    parentName: \"ul\"\n  }, mdx(\"p\", {\n    parentName: \"li\"\n  }, \"observations by teachers and related services providers\"))), mdx(\"p\", null, \"On the basis of that review, and input from the child\\u2019s parents, the IEP team will identify what additional data, if any, is needed to determine \\u2014\"), mdx(\"ul\", null, mdx(\"li\", {\n    parentName: \"ul\"\n  }, mdx(\"p\", {\n    parentName: \"li\"\n  }, \"whether your child is a child with a disability as defined in section 1401(3)\")), mdx(\"li\", {\n    parentName: \"ul\"\n  }, mdx(\"p\", {\n    parentName: \"li\"\n  }, \"the educational needs of your child\")), mdx(\"li\", {\n    parentName: \"ul\"\n  }, mdx(\"p\", {\n    parentName: \"li\"\n  }, \"the present levels of academic achievement and related developmental needs of your child\")), mdx(\"li\", {\n    parentName: \"ul\"\n  }, mdx(\"p\", {\n    parentName: \"li\"\n  }, \"whether your child needs special education and related services to participate, as appropriate, in the general education curriculum\"))), mdx(\"h2\", {\n    \"id\": \"eligibility\",\n    \"style\": {\n      \"position\": \"relative\"\n    }\n  }, mdx(\"a\", {\n    parentName: \"h2\",\n    \"href\": \"#eligibility\",\n    \"aria-label\": \"eligibility permalink\",\n    \"className\": \"anchor before\"\n  }, mdx(\"svg\", {\n    parentName: \"a\",\n    \"aria-hidden\": \"true\",\n    \"focusable\": \"false\",\n    \"height\": \"16\",\n    \"version\": \"1.1\",\n    \"viewBox\": \"0 0 16 16\",\n    \"width\": \"16\"\n  }, mdx(\"path\", {\n    parentName: \"svg\",\n    \"fillRule\": \"evenodd\",\n    \"d\": \"M4 9h1v1H4c-1.5 0-3-1.69-3-3.5S2.55 3 4 3h4c1.45 0 3 1.69 3 3.5 0 1.41-.91 2.72-2 3.25V8.59c.58-.45 1-1.27 1-2.09C10 5.22 8.98 4 8 4H4c-.98 0-2 1.22-2 2.5S3 9 4 9zm9-3h-1v1h1c1 0 2 1.22 2 2.5S13.98 12 13 12H9c-.98 0-2-1.22-2-2.5 0-.83.42-1.64 1-2.09V6.25c-1.09.53-2 1.84-2 3.25C6 11.31 7.55 13 9 13h4c1.45 0 3-1.69 3-3.5S14.5 6 13 6z\"\n  }))), \"ELIGIBILITY\"), mdx(\"blockquote\", null, mdx(\"p\", {\n    parentName: \"blockquote\"\n  }, \"If your child only requires accommodations for ADHD, and not special education (specially designed instruction), then s/he is not a student with a disability under IDEA and not eligible for an IEP. Such a student may be eligible for accommodations for ADHD under Section 504 of the Vocational Rehabilitation Act.\")), mdx(\"p\", null, \"To qualify for special education services, a student must meet three criteria: \"), mdx(\"ul\", null, mdx(\"li\", {\n    parentName: \"ul\"\n  }, mdx(\"p\", {\n    parentName: \"li\"\n  }, \"The student has one of the identified disabilities outlined in the IDEA: ADHD is listed as a \", mdx(\"a\", {\n    parentName: \"p\",\n    \"href\": \"\"\n  }, \"specific learning disability\"), \".\")), mdx(\"li\", {\n    parentName: \"ul\"\n  }, mdx(\"p\", {\n    parentName: \"li\"\n  }, \"The disability must adversely affect the student\\u2019s \", mdx(\"a\", {\n    parentName: \"p\",\n    \"href\": \"\"\n  }, \"educational performance\"), \", including all of the school program, not just academics.\")), mdx(\"li\", {\n    parentName: \"ul\"\n  }, mdx(\"p\", {\n    parentName: \"li\"\n  }, \"The student requires \", mdx(\"a\", {\n    parentName: \"p\",\n    \"href\": \"\"\n  }, \"special education and related services\"), \". \"))), mdx(\"p\", null, \"If the student doesn\\u2019t meet the criteria, then the student is not eligible for special education. Ask yourself:\"), mdx(\"ul\", null, mdx(\"li\", {\n    parentName: \"ul\"\n  }, mdx(\"p\", {\n    parentName: \"li\"\n  }, \"Does my child have a \", mdx(\"a\", {\n    parentName: \"p\",\n    \"href\": \"\"\n  }, \"diagnosis of ADHD\"), \"?\")), mdx(\"li\", {\n    parentName: \"ul\"\n  }, mdx(\"p\", {\n    parentName: \"li\"\n  }, \"Does ADHD adversely affect my child's \", mdx(\"a\", {\n    parentName: \"p\",\n    \"href\": \"\"\n  }, \"educational performance\"), \"? Not just academics.\")), mdx(\"li\", {\n    parentName: \"ul\"\n  }, mdx(\"p\", {\n    parentName: \"li\"\n  }, \"Does my child require \", mdx(\"a\", {\n    parentName: \"p\",\n    \"href\": \"\"\n  }, \"specially designed instruction\"), \" as a result of his or her ADHD?\"))), mdx(\"p\", null, \"To be eligible for an IEP the answer to each of these questions must be Yes.\"), mdx(\"blockquote\", null, mdx(\"p\", {\n    parentName: \"blockquote\"\n  }, \"Decisions about eligibility are made by a team that includes the parents. Parental input must be considered. If the child is determined not eligible, parents have the right to disagree and use any of the \", mdx(\"a\", {\n    parentName: \"p\",\n    \"href\": \"\"\n  }, \"dispute resolution remedies\"), \" as outlined here.\")), mdx(\"h2\", {\n    \"id\": \"discipline\",\n    \"style\": {\n      \"position\": \"relative\"\n    }\n  }, mdx(\"a\", {\n    parentName: \"h2\",\n    \"href\": \"#discipline\",\n    \"aria-label\": \"discipline permalink\",\n    \"className\": \"anchor before\"\n  }, mdx(\"svg\", {\n    parentName: \"a\",\n    \"aria-hidden\": \"true\",\n    \"focusable\": \"false\",\n    \"height\": \"16\",\n    \"version\": \"1.1\",\n    \"viewBox\": \"0 0 16 16\",\n    \"width\": \"16\"\n  }, mdx(\"path\", {\n    parentName: \"svg\",\n    \"fillRule\": \"evenodd\",\n    \"d\": \"M4 9h1v1H4c-1.5 0-3-1.69-3-3.5S2.55 3 4 3h4c1.45 0 3 1.69 3 3.5 0 1.41-.91 2.72-2 3.25V8.59c.58-.45 1-1.27 1-2.09C10 5.22 8.98 4 8 4H4c-.98 0-2 1.22-2 2.5S3 9 4 9zm9-3h-1v1h1c1 0 2 1.22 2 2.5S13.98 12 13 12H9c-.98 0-2-1.22-2-2.5 0-.83.42-1.64 1-2.09V6.25c-1.09.53-2 1.84-2 3.25C6 11.31 7.55 13 9 13h4c1.45 0 3-1.69 3-3.5S14.5 6 13 6z\"\n  }))), \"Discipline\"), mdx(\"p\", null, \"If your child misbehaves and the school determines your child\\u2019s behavior is not a manifestation of their ADHD, your child can be expelled from school permanently. Under IDEA, your child has the right to a free appropriate public education and the school has the responsibility to provide it, even if the child is expelled. Section 504 does not provide this protection.\"), mdx(\"p\", null, \"This section on Behavioral Plans and discipline needs to be fleshed out.\"));\n}\n;\nMDXContent.isMDXComponent = true;","tableOfContents":{"items":[{"url":"#what-is-an-iep","title":"What is an IEP?"},{"url":"#what-is-a-504-plan","title":"What is a 504 Plan?"},{"url":"#whats-the-difference","title":"What's The Difference?"},{"url":"#qualifying-for-accommodations-for-adhd-thru-a-variety-of-assessment-tools","title":"Qualifying for Accommodations for ADHD thru A Variety of Assessment Tools"},{"url":"#is-there-enough-data-to-determine-if-accommodations-for-adhd-are-necessary","title":"Is there Enough Data To Determine If Accommodations for ADHD are necessary?"},{"url":"#eligibility","title":"ELIGIBILITY"},{"url":"#discipline","title":"Discipline"}]}}},"pageContext":{"id":"1f21a9d6-8e2a-5c81-a85d-dce0b8b14f9a","slug":"ieps-and-504s","__params":{"slug":"ieps-and-504s"}}},"staticQueryHashes":["2940230738","3649515864","63159454"]}