{"componentChunkName":"component---src-pages-accomodations-for-students-with-adhd-mdx-slug-js","path":"/accomodations-for-students-with-adhd/start-here/","result":{"data":{"mdx":{"frontmatter":{"title":"Start Here","chapter":100,"keywords":"accommodations for adhd, accommodations for students with adhd, accommodations for adhd elementary students","publish":"June 18, 2022","update":"June 18, 2022","short":"\nStart here.\n","hero_alt":"Alt text from mdx.","hero_image":{"childImageSharp":{"gatsbyImageData":{"layout":"constrained","backgroundColor":"#f8e8d8","images":{"fallback":{"src":"/static/3ab5c1f172f94822dfcffed81514c760/87706/504_plan_or_iep.png","srcSet":"/static/3ab5c1f172f94822dfcffed81514c760/f80f8/504_plan_or_iep.png 320w,\n/static/3ab5c1f172f94822dfcffed81514c760/9a63f/504_plan_or_iep.png 640w,\n/static/3ab5c1f172f94822dfcffed81514c760/87706/504_plan_or_iep.png 1280w","sizes":"(min-width: 1280px) 1280px, 100vw"},"sources":[{"srcSet":"/static/3ab5c1f172f94822dfcffed81514c760/c0bcc/504_plan_or_iep.webp 320w,\n/static/3ab5c1f172f94822dfcffed81514c760/17574/504_plan_or_iep.webp 640w,\n/static/3ab5c1f172f94822dfcffed81514c760/71d4d/504_plan_or_iep.webp 1280w","type":"image/webp","sizes":"(min-width: 1280px) 1280px, 100vw"}]},"width":1280,"height":720}}}},"slug":"start-here","body":"var _excluded = [\"components\"];\n\nfunction _extends() { _extends = Object.assign ? Object.assign.bind() : function (target) { for (var i = 1; i < arguments.length; i++) { var source = arguments[i]; for (var key in source) { if (Object.prototype.hasOwnProperty.call(source, key)) { target[key] = source[key]; } } } return target; }; return _extends.apply(this, arguments); }\n\nfunction _objectWithoutProperties(source, excluded) { if (source == null) return {}; var target = _objectWithoutPropertiesLoose(source, excluded); var key, i; if (Object.getOwnPropertySymbols) { var sourceSymbolKeys = Object.getOwnPropertySymbols(source); for (i = 0; i < sourceSymbolKeys.length; i++) { key = sourceSymbolKeys[i]; if (excluded.indexOf(key) >= 0) continue; if (!Object.prototype.propertyIsEnumerable.call(source, key)) continue; target[key] = source[key]; } } return target; }\n\nfunction _objectWithoutPropertiesLoose(source, excluded) { if (source == null) return {}; var target = {}; var sourceKeys = Object.keys(source); var key, i; for (i = 0; i < sourceKeys.length; i++) { key = sourceKeys[i]; if (excluded.indexOf(key) >= 0) continue; target[key] = source[key]; } return target; }\n\n/* @jsxRuntime classic */\n\n/* @jsx mdx */\nvar _frontmatter = {\n  \"title\": \"Start Here\",\n  \"chapter\": 100,\n  \"publish\": \"2022-06-18\",\n  \"update\": \"2022-06-18\",\n  \"hero_image\": \"./media/504_plan_or_iep.png\",\n  \"hero_alt\": \"Alt text from mdx.\",\n  \"author\": \"Rho Lall\",\n  \"keywords\": \"accommodations for adhd, accommodations for students with adhd, accommodations for adhd elementary students\",\n  \"short\": \"\\nStart here.\\n\"\n};\nvar layoutProps = {\n  _frontmatter: _frontmatter\n};\nvar MDXLayout = \"wrapper\";\nreturn function MDXContent(_ref) {\n  var components = _ref.components,\n      props = _objectWithoutProperties(_ref, _excluded);\n\n  return mdx(MDXLayout, _extends({}, layoutProps, props, {\n    components: components,\n    mdxType: \"MDXLayout\"\n  }), mdx(\"h2\", {\n    \"id\": \"breath\",\n    \"style\": {\n      \"position\": \"relative\"\n    }\n  }, mdx(\"a\", {\n    parentName: \"h2\",\n    \"href\": \"#breath\",\n    \"aria-label\": \"breath permalink\",\n    \"className\": \"anchor before\"\n  }, mdx(\"svg\", {\n    parentName: \"a\",\n    \"aria-hidden\": \"true\",\n    \"focusable\": \"false\",\n    \"height\": \"16\",\n    \"version\": \"1.1\",\n    \"viewBox\": \"0 0 16 16\",\n    \"width\": \"16\"\n  }, mdx(\"path\", {\n    parentName: \"svg\",\n    \"fillRule\": \"evenodd\",\n    \"d\": \"M4 9h1v1H4c-1.5 0-3-1.69-3-3.5S2.55 3 4 3h4c1.45 0 3 1.69 3 3.5 0 1.41-.91 2.72-2 3.25V8.59c.58-.45 1-1.27 1-2.09C10 5.22 8.98 4 8 4H4c-.98 0-2 1.22-2 2.5S3 9 4 9zm9-3h-1v1h1c1 0 2 1.22 2 2.5S13.98 12 13 12H9c-.98 0-2-1.22-2-2.5 0-.83.42-1.64 1-2.09V6.25c-1.09.53-2 1.84-2 3.25C6 11.31 7.55 13 9 13h4c1.45 0 3-1.69 3-3.5S14.5 6 13 6z\"\n  }))), \"Breath\"), mdx(\"p\", null, \"Many parents of children with ADHD find themselves feeling frustrated and exhausted when it comes to negotiating with the school.\\nIt can be an ordeal to try to get the accommodations that your child needs in order to be successful. Some parents give up and decide that it's not worth the fight.\\nHowever, other parents prevail and are able to get the accommodations that their child needs. What makes the difference? Research, planning, and preparation.\\nIf you take the time to research what accommodations are available for students with ADHD, you will be better prepared to make a case for why your child needs them.\\nYou will also be more likely to have a successful outcome if you take the time to plan and prepare for your meeting with the school.\\nDisability is a natural part of the human experiance and in no way diminishes your child's right to participate in and contribute to society - know what you want and be ready to fight for it. With a little bit of effort, you can make sure that your child gets the accommodations he or she needs to be successful in school.\"), mdx(\"h2\", {\n    \"id\": \"the-three-hats-you-wear\",\n    \"style\": {\n      \"position\": \"relative\"\n    }\n  }, mdx(\"a\", {\n    parentName: \"h2\",\n    \"href\": \"#the-three-hats-you-wear\",\n    \"aria-label\": \"the three hats you wear permalink\",\n    \"className\": \"anchor before\"\n  }, mdx(\"svg\", {\n    parentName: \"a\",\n    \"aria-hidden\": \"true\",\n    \"focusable\": \"false\",\n    \"height\": \"16\",\n    \"version\": \"1.1\",\n    \"viewBox\": \"0 0 16 16\",\n    \"width\": \"16\"\n  }, mdx(\"path\", {\n    parentName: \"svg\",\n    \"fillRule\": \"evenodd\",\n    \"d\": \"M4 9h1v1H4c-1.5 0-3-1.69-3-3.5S2.55 3 4 3h4c1.45 0 3 1.69 3 3.5 0 1.41-.91 2.72-2 3.25V8.59c.58-.45 1-1.27 1-2.09C10 5.22 8.98 4 8 4H4c-.98 0-2 1.22-2 2.5S3 9 4 9zm9-3h-1v1h1c1 0 2 1.22 2 2.5S13.98 12 13 12H9c-.98 0-2-1.22-2-2.5 0-.83.42-1.64 1-2.09V6.25c-1.09.53-2 1.84-2 3.25C6 11.31 7.55 13 9 13h4c1.45 0 3-1.69 3-3.5S14.5 6 13 6z\"\n  }))), \"The Three Hats You Wear\"), mdx(\"p\", null, \"As the parent of a child with ADHD, you will find yourself wearing many different hats. Often, you will be called upon to be a subject matter expert, providing information and support to teachers, therapists, and other professionals who are working with your child. Additionally, you will play the role of advocate, ensuring that your child's needs. Finally, you may also find yourself taking on the role of project manager, coordinating services and creating systems to help your IEP team succeed. Each of these roles requires a different set of skills, but all are essential in supporting your child's success. With a little knowledge and a lot of dedication, you can wear all three hats with ease.\"), mdx(\"p\", null, mdx(\"strong\", {\n    parentName: \"p\"\n  }, \"Subject Matter Expert.\"), \" Learn about your child's ADHD and how ADHD affects your child's ability to learn. How does it affect your child specifically: their learning, appropriate educational remediation techniques, & measuring educational progress. Learn the laws that apply to your child's situation. There is statutory, regulatory, & case law that you will need to know. Learn from other parents, school personal, and other advocates.\"), mdx(\"p\", null, mdx(\"strong\", {\n    parentName: \"p\"\n  }, \"Advocate.\"), \" You are the natural advocate for your child. There are different types of advocates: lay advocates, educational advocates, school personnel, and parents. Lay advocates use their specialized knowledge and expertise to help parents resolve problems with schools. Educational advocates evaluate children with disabilities and make recommendations about services. When educational advocates go to eligibility and IEP meetings they are acting on the child's behalf. Don't underestimate yourself. Parents are natural advocates for their children.\"), mdx(\"p\", null, \"As a case manager, I have had the opportunity to advocate on behalf of a variety of families navigating a network of bureaucracy to obtain appropriate services. In my experience, one of the biggest challenges families face is getting accommodations for students with ADHD. Too often, students with ADHD are placed in regular education classrooms without the support they need to be successful. As a result, they can quickly fall behind and become frustrated and discouraged. I have seen firsthand the difference that accommodations can make for students with ADHD. When they have the supports they need, they are able to thrive in school and reach their full potential. I believe all students with ADHD deserve access to accommodations that will allow them to succeed.\"), mdx(\"p\", null, mdx(\"strong\", {\n    parentName: \"p\"\n  }, \"Project Manager.\"), \" Managing an IEP can feel like a daunting task, but with a bit of planning and organization, it can be manageable - and even enjoyable! The key is to break the project down into smaller tasks, and then create a plan of action for each task. For example, if one of your goals is to get accommodations for students with ADHD, you might create a task list that includes research accommodations, reaching out to experts, and writing goals. By taking things one step at a time, you can make the process of managing an IEP much less overwhelming. And, by focusing on results, you can ensure that your efforts are effective and impactful. \"), mdx(\"h2\", {\n    \"id\": \"outline\",\n    \"style\": {\n      \"position\": \"relative\"\n    }\n  }, mdx(\"a\", {\n    parentName: \"h2\",\n    \"href\": \"#outline\",\n    \"aria-label\": \"outline permalink\",\n    \"className\": \"anchor before\"\n  }, mdx(\"svg\", {\n    parentName: \"a\",\n    \"aria-hidden\": \"true\",\n    \"focusable\": \"false\",\n    \"height\": \"16\",\n    \"version\": \"1.1\",\n    \"viewBox\": \"0 0 16 16\",\n    \"width\": \"16\"\n  }, mdx(\"path\", {\n    parentName: \"svg\",\n    \"fillRule\": \"evenodd\",\n    \"d\": \"M4 9h1v1H4c-1.5 0-3-1.69-3-3.5S2.55 3 4 3h4c1.45 0 3 1.69 3 3.5 0 1.41-.91 2.72-2 3.25V8.59c.58-.45 1-1.27 1-2.09C10 5.22 8.98 4 8 4H4c-.98 0-2 1.22-2 2.5S3 9 4 9zm9-3h-1v1h1c1 0 2 1.22 2 2.5S13.98 12 13 12H9c-.98 0-2-1.22-2-2.5 0-.83.42-1.64 1-2.09V6.25c-1.09.53-2 1.84-2 3.25C6 11.31 7.55 13 9 13h4c1.45 0 3-1.69 3-3.5S14.5 6 13 6z\"\n  }))), \"Outline\"), mdx(\"h3\", {\n    \"id\": \"start-here\",\n    \"style\": {\n      \"position\": \"relative\"\n    }\n  }, mdx(\"a\", {\n    parentName: \"h3\",\n    \"href\": \"#start-here\",\n    \"aria-label\": \"start here permalink\",\n    \"className\": \"anchor before\"\n  }, mdx(\"svg\", {\n    parentName: \"a\",\n    \"aria-hidden\": \"true\",\n    \"focusable\": \"false\",\n    \"height\": \"16\",\n    \"version\": \"1.1\",\n    \"viewBox\": \"0 0 16 16\",\n    \"width\": \"16\"\n  }, mdx(\"path\", {\n    parentName: \"svg\",\n    \"fillRule\": \"evenodd\",\n    \"d\": \"M4 9h1v1H4c-1.5 0-3-1.69-3-3.5S2.55 3 4 3h4c1.45 0 3 1.69 3 3.5 0 1.41-.91 2.72-2 3.25V8.59c.58-.45 1-1.27 1-2.09C10 5.22 8.98 4 8 4H4c-.98 0-2 1.22-2 2.5S3 9 4 9zm9-3h-1v1h1c1 0 2 1.22 2 2.5S13.98 12 13 12H9c-.98 0-2-1.22-2-2.5 0-.83.42-1.64 1-2.09V6.25c-1.09.53-2 1.84-2 3.25C6 11.31 7.55 13 9 13h4c1.45 0 3-1.69 3-3.5S14.5 6 13 6z\"\n  }))), \"Start Here\"), mdx(\"p\", null, \"We stary you here with a broad overview of what you need to know and what you need to get going. Here we cover step one, request to have your child tested for an IEP.\"), mdx(\"ul\", null, mdx(\"li\", {\n    parentName: \"ul\"\n  }, \"Testing Your Child for an IEP: Why It's Important and How to Do It\")), mdx(\"h3\", {\n    \"id\": \"organization-tips-for-the-busy-parent\",\n    \"style\": {\n      \"position\": \"relative\"\n    }\n  }, mdx(\"a\", {\n    parentName: \"h3\",\n    \"href\": \"#organization-tips-for-the-busy-parent\",\n    \"aria-label\": \"organization tips for the busy parent permalink\",\n    \"className\": \"anchor before\"\n  }, mdx(\"svg\", {\n    parentName: \"a\",\n    \"aria-hidden\": \"true\",\n    \"focusable\": \"false\",\n    \"height\": \"16\",\n    \"version\": \"1.1\",\n    \"viewBox\": \"0 0 16 16\",\n    \"width\": \"16\"\n  }, mdx(\"path\", {\n    parentName: \"svg\",\n    \"fillRule\": \"evenodd\",\n    \"d\": \"M4 9h1v1H4c-1.5 0-3-1.69-3-3.5S2.55 3 4 3h4c1.45 0 3 1.69 3 3.5 0 1.41-.91 2.72-2 3.25V8.59c.58-.45 1-1.27 1-2.09C10 5.22 8.98 4 8 4H4c-.98 0-2 1.22-2 2.5S3 9 4 9zm9-3h-1v1h1c1 0 2 1.22 2 2.5S13.98 12 13 12H9c-.98 0-2-1.22-2-2.5 0-.83.42-1.64 1-2.09V6.25c-1.09.53-2 1.84-2 3.25C6 11.31 7.55 13 9 13h4c1.45 0 3-1.69 3-3.5S14.5 6 13 6z\"\n  }))), \"Organization Tips for the Busy Parent\"), mdx(\"p\", null, \"After you request your child be tested the next most critical thing you need is to organize your documentation. In this section we cover step two, get organized. Half the battle is already won through organization and preparation. This isn't a prerequisite to the work at hand . . . this is the work at hand.\"), mdx(\"h3\", {\n    \"id\": \"why-an-iep-may-be-better-than-a-504-plan-for-your-adhd-elemetary-student\",\n    \"style\": {\n      \"position\": \"relative\"\n    }\n  }, mdx(\"a\", {\n    parentName: \"h3\",\n    \"href\": \"#why-an-iep-may-be-better-than-a-504-plan-for-your-adhd-elemetary-student\",\n    \"aria-label\": \"why an iep may be better than a 504 plan for your adhd elemetary student permalink\",\n    \"className\": \"anchor before\"\n  }, mdx(\"svg\", {\n    parentName: \"a\",\n    \"aria-hidden\": \"true\",\n    \"focusable\": \"false\",\n    \"height\": \"16\",\n    \"version\": \"1.1\",\n    \"viewBox\": \"0 0 16 16\",\n    \"width\": \"16\"\n  }, mdx(\"path\", {\n    parentName: \"svg\",\n    \"fillRule\": \"evenodd\",\n    \"d\": \"M4 9h1v1H4c-1.5 0-3-1.69-3-3.5S2.55 3 4 3h4c1.45 0 3 1.69 3 3.5 0 1.41-.91 2.72-2 3.25V8.59c.58-.45 1-1.27 1-2.09C10 5.22 8.98 4 8 4H4c-.98 0-2 1.22-2 2.5S3 9 4 9zm9-3h-1v1h1c1 0 2 1.22 2 2.5S13.98 12 13 12H9c-.98 0-2-1.22-2-2.5 0-.83.42-1.64 1-2.09V6.25c-1.09.53-2 1.84-2 3.25C6 11.31 7.55 13 9 13h4c1.45 0 3-1.69 3-3.5S14.5 6 13 6z\"\n  }))), \"Why an IEP May Be Better Than a 504 Plan for Your ADHD Elemetary Student\"), mdx(\"p\", null, \"This section and the ones that follow will help you get up the learning curve on subject matter expertise. In this section we discuss IEPs, 504s, and the differences. I've created specific sections for each of them:\"), mdx(\"ul\", null, mdx(\"li\", {\n    parentName: \"ul\"\n  }, \"IEPs for ADHD\"), mdx(\"li\", {\n    parentName: \"ul\"\n  }, \"504 Plans for ADHD\")), mdx(\"h3\", {\n    \"id\": \"how-to-be-an-effective-project-manager-for-your-childs-iep-team\",\n    \"style\": {\n      \"position\": \"relative\"\n    }\n  }, mdx(\"a\", {\n    parentName: \"h3\",\n    \"href\": \"#how-to-be-an-effective-project-manager-for-your-childs-iep-team\",\n    \"aria-label\": \"how to be an effective project manager for your childs iep team permalink\",\n    \"className\": \"anchor before\"\n  }, mdx(\"svg\", {\n    parentName: \"a\",\n    \"aria-hidden\": \"true\",\n    \"focusable\": \"false\",\n    \"height\": \"16\",\n    \"version\": \"1.1\",\n    \"viewBox\": \"0 0 16 16\",\n    \"width\": \"16\"\n  }, mdx(\"path\", {\n    parentName: \"svg\",\n    \"fillRule\": \"evenodd\",\n    \"d\": \"M4 9h1v1H4c-1.5 0-3-1.69-3-3.5S2.55 3 4 3h4c1.45 0 3 1.69 3 3.5 0 1.41-.91 2.72-2 3.25V8.59c.58-.45 1-1.27 1-2.09C10 5.22 8.98 4 8 4H4c-.98 0-2 1.22-2 2.5S3 9 4 9zm9-3h-1v1h1c1 0 2 1.22 2 2.5S13.98 12 13 12H9c-.98 0-2-1.22-2-2.5 0-.83.42-1.64 1-2.09V6.25c-1.09.53-2 1.84-2 3.25C6 11.31 7.55 13 9 13h4c1.45 0 3-1.69 3-3.5S14.5 6 13 6z\"\n  }))), \"How to Be An Effective Project Manager for Your Child's IEP Team\"), mdx(\"p\", null, \"These sections are ordered according to immediacy, what you need to know as you go through the steps to secure accommodations for your ADHD elementary student. This next section focuses on project management topics around setting goals. Later when you create an IEP half the work is setting goals. Topics include:\"), mdx(\"ul\", null, mdx(\"li\", {\n    parentName: \"ul\"\n  }, \"IEP Team Members, Roles, and Responsibilities\"), mdx(\"li\", {\n    parentName: \"ul\"\n  }, \"The Scrum Method for School Projects\"), mdx(\"li\", {\n    parentName: \"ul\"\n  }, \"How to Develop Page One\")), mdx(\"h3\", {\n    \"id\": \"the-top-10-things-you-should-know-about-adhd\",\n    \"style\": {\n      \"position\": \"relative\"\n    }\n  }, mdx(\"a\", {\n    parentName: \"h3\",\n    \"href\": \"#the-top-10-things-you-should-know-about-adhd\",\n    \"aria-label\": \"the top 10 things you should know about adhd permalink\",\n    \"className\": \"anchor before\"\n  }, mdx(\"svg\", {\n    parentName: \"a\",\n    \"aria-hidden\": \"true\",\n    \"focusable\": \"false\",\n    \"height\": \"16\",\n    \"version\": \"1.1\",\n    \"viewBox\": \"0 0 16 16\",\n    \"width\": \"16\"\n  }, mdx(\"path\", {\n    parentName: \"svg\",\n    \"fillRule\": \"evenodd\",\n    \"d\": \"M4 9h1v1H4c-1.5 0-3-1.69-3-3.5S2.55 3 4 3h4c1.45 0 3 1.69 3 3.5 0 1.41-.91 2.72-2 3.25V8.59c.58-.45 1-1.27 1-2.09C10 5.22 8.98 4 8 4H4c-.98 0-2 1.22-2 2.5S3 9 4 9zm9-3h-1v1h1c1 0 2 1.22 2 2.5S13.98 12 13 12H9c-.98 0-2-1.22-2-2.5 0-.83.42-1.64 1-2.09V6.25c-1.09.53-2 1.84-2 3.25C6 11.31 7.55 13 9 13h4c1.45 0 3-1.69 3-3.5S14.5 6 13 6z\"\n  }))), \"The Top 10 Things You Should Know About ADHD\"), mdx(\"p\", null, \"In this section we circle back to building subject matter expertise specifically about ADHD. Topics include:\"), mdx(\"ul\", null, mdx(\"li\", {\n    parentName: \"ul\"\n  }, \"ADHD in the Classroom\"), mdx(\"li\", {\n    parentName: \"ul\"\n  }, \"High Achievers with ADHD\")), mdx(\"h3\", {\n    \"id\": \"what-every-parent-of-an-adhd-child-should-know-about-their-legal-rights\",\n    \"style\": {\n      \"position\": \"relative\"\n    }\n  }, mdx(\"a\", {\n    parentName: \"h3\",\n    \"href\": \"#what-every-parent-of-an-adhd-child-should-know-about-their-legal-rights\",\n    \"aria-label\": \"what every parent of an adhd child should know about their legal rights permalink\",\n    \"className\": \"anchor before\"\n  }, mdx(\"svg\", {\n    parentName: \"a\",\n    \"aria-hidden\": \"true\",\n    \"focusable\": \"false\",\n    \"height\": \"16\",\n    \"version\": \"1.1\",\n    \"viewBox\": \"0 0 16 16\",\n    \"width\": \"16\"\n  }, mdx(\"path\", {\n    parentName: \"svg\",\n    \"fillRule\": \"evenodd\",\n    \"d\": \"M4 9h1v1H4c-1.5 0-3-1.69-3-3.5S2.55 3 4 3h4c1.45 0 3 1.69 3 3.5 0 1.41-.91 2.72-2 3.25V8.59c.58-.45 1-1.27 1-2.09C10 5.22 8.98 4 8 4H4c-.98 0-2 1.22-2 2.5S3 9 4 9zm9-3h-1v1h1c1 0 2 1.22 2 2.5S13.98 12 13 12H9c-.98 0-2-1.22-2-2.5 0-.83.42-1.64 1-2.09V6.25c-1.09.53-2 1.84-2 3.25C6 11.31 7.55 13 9 13h4c1.45 0 3-1.69 3-3.5S14.5 6 13 6z\"\n  }))), \"What Every Parent of an ADHD Child Should Know About Their Legal Rights\"), mdx(\"p\", null, \"In this section we dig deep into the law to understand your rights and your ADHD student's rights. Topics include:\"), mdx(\"ul\", null, mdx(\"li\", {\n    parentName: \"ul\"\n  }, \"Accommodations for ADHD\"), mdx(\"li\", {\n    parentName: \"ul\"\n  }, \"504 Accommodations for ADHD\"), mdx(\"li\", {\n    parentName: \"ul\"\n  }, \"Classroom Accommodations for ADHD\")), mdx(\"h3\", {\n    \"id\": \"why-parents-are-the-best-advocates-for-their-children\",\n    \"style\": {\n      \"position\": \"relative\"\n    }\n  }, mdx(\"a\", {\n    parentName: \"h3\",\n    \"href\": \"#why-parents-are-the-best-advocates-for-their-children\",\n    \"aria-label\": \"why parents are the best advocates for their children permalink\",\n    \"className\": \"anchor before\"\n  }, mdx(\"svg\", {\n    parentName: \"a\",\n    \"aria-hidden\": \"true\",\n    \"focusable\": \"false\",\n    \"height\": \"16\",\n    \"version\": \"1.1\",\n    \"viewBox\": \"0 0 16 16\",\n    \"width\": \"16\"\n  }, mdx(\"path\", {\n    parentName: \"svg\",\n    \"fillRule\": \"evenodd\",\n    \"d\": \"M4 9h1v1H4c-1.5 0-3-1.69-3-3.5S2.55 3 4 3h4c1.45 0 3 1.69 3 3.5 0 1.41-.91 2.72-2 3.25V8.59c.58-.45 1-1.27 1-2.09C10 5.22 8.98 4 8 4H4c-.98 0-2 1.22-2 2.5S3 9 4 9zm9-3h-1v1h1c1 0 2 1.22 2 2.5S13.98 12 13 12H9c-.98 0-2-1.22-2-2.5 0-.83.42-1.64 1-2.09V6.25c-1.09.53-2 1.84-2 3.25C6 11.31 7.55 13 9 13h4c1.45 0 3-1.69 3-3.5S14.5 6 13 6z\"\n  }))), \"Why Parents Are the Best Advocates for Their Children\"), mdx(\"ul\", null, mdx(\"li\", {\n    parentName: \"ul\"\n  }, \"The Rule of Adverse Asumptions\"), mdx(\"li\", {\n    parentName: \"ul\"\n  }, \"Creating Paper Trails\"), mdx(\"li\", {\n    parentName: \"ul\"\n  }, \"Preparing for Meetings\"), mdx(\"li\", {\n    parentName: \"ul\"\n  }, \"Leading Effective Meetings\")), mdx(\"h3\", {\n    \"id\": \"how-to-write-effective-letters\",\n    \"style\": {\n      \"position\": \"relative\"\n    }\n  }, mdx(\"a\", {\n    parentName: \"h3\",\n    \"href\": \"#how-to-write-effective-letters\",\n    \"aria-label\": \"how to write effective letters permalink\",\n    \"className\": \"anchor before\"\n  }, mdx(\"svg\", {\n    parentName: \"a\",\n    \"aria-hidden\": \"true\",\n    \"focusable\": \"false\",\n    \"height\": \"16\",\n    \"version\": \"1.1\",\n    \"viewBox\": \"0 0 16 16\",\n    \"width\": \"16\"\n  }, mdx(\"path\", {\n    parentName: \"svg\",\n    \"fillRule\": \"evenodd\",\n    \"d\": \"M4 9h1v1H4c-1.5 0-3-1.69-3-3.5S2.55 3 4 3h4c1.45 0 3 1.69 3 3.5 0 1.41-.91 2.72-2 3.25V8.59c.58-.45 1-1.27 1-2.09C10 5.22 8.98 4 8 4H4c-.98 0-2 1.22-2 2.5S3 9 4 9zm9-3h-1v1h1c1 0 2 1.22 2 2.5S13.98 12 13 12H9c-.98 0-2-1.22-2-2.5 0-.83.42-1.64 1-2.09V6.25c-1.09.53-2 1.84-2 3.25C6 11.31 7.55 13 9 13h4c1.45 0 3-1.69 3-3.5S14.5 6 13 6z\"\n  }))), \"How to Write Effective Letters\"), mdx(\"ul\", null, mdx(\"li\", {\n    parentName: \"ul\"\n  }, \"Why Write Letters\"), mdx(\"li\", {\n    parentName: \"ul\"\n  }, \"Evidence Letters\"), mdx(\"li\", {\n    parentName: \"ul\"\n  }, \"Sample Letters\"), mdx(\"li\", {\n    parentName: \"ul\"\n  }, \"Letters to the Stranger\")), mdx(\"h3\", {\n    \"id\": \"questions--answers\",\n    \"style\": {\n      \"position\": \"relative\"\n    }\n  }, mdx(\"a\", {\n    parentName: \"h3\",\n    \"href\": \"#questions--answers\",\n    \"aria-label\": \"questions  answers permalink\",\n    \"className\": \"anchor before\"\n  }, mdx(\"svg\", {\n    parentName: \"a\",\n    \"aria-hidden\": \"true\",\n    \"focusable\": \"false\",\n    \"height\": \"16\",\n    \"version\": \"1.1\",\n    \"viewBox\": \"0 0 16 16\",\n    \"width\": \"16\"\n  }, mdx(\"path\", {\n    parentName: \"svg\",\n    \"fillRule\": \"evenodd\",\n    \"d\": \"M4 9h1v1H4c-1.5 0-3-1.69-3-3.5S2.55 3 4 3h4c1.45 0 3 1.69 3 3.5 0 1.41-.91 2.72-2 3.25V8.59c.58-.45 1-1.27 1-2.09C10 5.22 8.98 4 8 4H4c-.98 0-2 1.22-2 2.5S3 9 4 9zm9-3h-1v1h1c1 0 2 1.22 2 2.5S13.98 12 13 12H9c-.98 0-2-1.22-2-2.5 0-.83.42-1.64 1-2.09V6.25c-1.09.53-2 1.84-2 3.25C6 11.31 7.55 13 9 13h4c1.45 0 3-1.69 3-3.5S14.5 6 13 6z\"\n  }))), \"Questions & Answers\"), mdx(\"p\", null, \"Finally we close with a list of quesitons that come up, and thier answers.\"), mdx(\"h2\", {\n    \"id\": \"summary\",\n    \"style\": {\n      \"position\": \"relative\"\n    }\n  }, mdx(\"a\", {\n    parentName: \"h2\",\n    \"href\": \"#summary\",\n    \"aria-label\": \"summary permalink\",\n    \"className\": \"anchor before\"\n  }, mdx(\"svg\", {\n    parentName: \"a\",\n    \"aria-hidden\": \"true\",\n    \"focusable\": \"false\",\n    \"height\": \"16\",\n    \"version\": \"1.1\",\n    \"viewBox\": \"0 0 16 16\",\n    \"width\": \"16\"\n  }, mdx(\"path\", {\n    parentName: \"svg\",\n    \"fillRule\": \"evenodd\",\n    \"d\": \"M4 9h1v1H4c-1.5 0-3-1.69-3-3.5S2.55 3 4 3h4c1.45 0 3 1.69 3 3.5 0 1.41-.91 2.72-2 3.25V8.59c.58-.45 1-1.27 1-2.09C10 5.22 8.98 4 8 4H4c-.98 0-2 1.22-2 2.5S3 9 4 9zm9-3h-1v1h1c1 0 2 1.22 2 2.5S13.98 12 13 12H9c-.98 0-2-1.22-2-2.5 0-.83.42-1.64 1-2.09V6.25c-1.09.53-2 1.84-2 3.25C6 11.31 7.55 13 9 13h4c1.45 0 3-1.69 3-3.5S14.5 6 13 6z\"\n  }))), \"Summary\"), mdx(\"p\", null, \"There are certain steps that you need to take. It\\u2019s easy to get overwhelmed. Just take it a step at a time and breath. \"), mdx(\"ul\", null, mdx(\"li\", {\n    parentName: \"ul\"\n  }, \"Request to have your child tested for an IEP. \"), mdx(\"li\", {\n    parentName: \"ul\"\n  }, \"Your child gets tested.\"), mdx(\"li\", {\n    parentName: \"ul\"\n  }, \"Meet with the school to discuss and review test results.\"), mdx(\"li\", {\n    parentName: \"ul\"\n  }, \"Start your path to subject mater expertise.\"), mdx(\"li\", {\n    parentName: \"ul\"\n  }, \"Manage outcomes of the IEP\")), mdx(\"p\", null, \"In addition to taking these initial steps there are three key roles that you as a parent play as part of the IEP team:\"), mdx(\"ul\", null, mdx(\"li\", {\n    parentName: \"ul\"\n  }, \"advocate\"), mdx(\"li\", {\n    parentName: \"ul\"\n  }, \"subject matter expert\"), mdx(\"li\", {\n    parentName: \"ul\"\n  }, \"project manager\")), mdx(\"p\", null, \"The secret to success is preparation. Do your own research. Plan. Stay organized. You are well on your way.\"));\n}\n;\nMDXContent.isMDXComponent = true;","tableOfContents":{"items":[{"url":"#breath","title":"Breath"},{"url":"#the-three-hats-you-wear","title":"The Three Hats You Wear"},{"url":"#outline","title":"Outline","items":[{"url":"#start-here","title":"Start Here"},{"url":"#organization-tips-for-the-busy-parent","title":"Organization Tips for the Busy Parent"},{"url":"#why-an-iep-may-be-better-than-a-504-plan-for-your-adhd-elemetary-student","title":"Why an IEP May Be Better Than a 504 Plan for Your ADHD Elemetary Student"},{"url":"#how-to-be-an-effective-project-manager-for-your-childs-iep-team","title":"How to Be An Effective Project Manager for Your Child's IEP Team"},{"url":"#the-top-10-things-you-should-know-about-adhd","title":"The Top 10 Things You Should Know About ADHD"},{"url":"#what-every-parent-of-an-adhd-child-should-know-about-their-legal-rights","title":"What Every Parent of an ADHD Child Should Know About Their Legal Rights"},{"url":"#why-parents-are-the-best-advocates-for-their-children","title":"Why Parents Are the Best Advocates for Their Children"},{"url":"#how-to-write-effective-letters","title":"How to Write Effective Letters"},{"url":"#questions--answers","title":"Questions & Answers"}]},{"url":"#summary","title":"Summary"}]}}},"pageContext":{"id":"d2aaf6be-f4a6-5b89-91df-8d67bdc6df03","slug":"start-here","__params":{"slug":"start-here"}}},"staticQueryHashes":["2940230738","3649515864","63159454"]}