{"componentChunkName":"component---src-pages-accomodations-for-adhd-mdx-slug-js","path":"/accomodations-for-adhd/getting-started/","result":{"data":{"mdx":{"frontmatter":{"title":"Getting Started","chapter":1,"keywords":"","publish":"June 18, 2022","update":"June 18, 2022","short":"\nStart here.\n","hero_alt":"Alt text from mdx.","hero_image":{"childImageSharp":{"gatsbyImageData":{"layout":"constrained","backgroundColor":"#081808","images":{"fallback":{"src":"/static/b0863357ed8e8efe48ed774b447c1ce9/87706/getting_started.png","srcSet":"/static/b0863357ed8e8efe48ed774b447c1ce9/f80f8/getting_started.png 320w,\n/static/b0863357ed8e8efe48ed774b447c1ce9/9a63f/getting_started.png 640w,\n/static/b0863357ed8e8efe48ed774b447c1ce9/87706/getting_started.png 1280w","sizes":"(min-width: 1280px) 1280px, 100vw"},"sources":[{"srcSet":"/static/b0863357ed8e8efe48ed774b447c1ce9/c0bcc/getting_started.webp 320w,\n/static/b0863357ed8e8efe48ed774b447c1ce9/17574/getting_started.webp 640w,\n/static/b0863357ed8e8efe48ed774b447c1ce9/71d4d/getting_started.webp 1280w","type":"image/webp","sizes":"(min-width: 1280px) 1280px, 100vw"}]},"width":1280,"height":720}}}},"slug":"getting-started","body":"var _excluded = [\"components\"];\n\nfunction _extends() { _extends = Object.assign ? Object.assign.bind() : function (target) { for (var i = 1; i < arguments.length; i++) { var source = arguments[i]; for (var key in source) { if (Object.prototype.hasOwnProperty.call(source, key)) { target[key] = source[key]; } } } return target; }; return _extends.apply(this, arguments); }\n\nfunction _objectWithoutProperties(source, excluded) { if (source == null) return {}; var target = _objectWithoutPropertiesLoose(source, excluded); var key, i; if (Object.getOwnPropertySymbols) { var sourceSymbolKeys = Object.getOwnPropertySymbols(source); for (i = 0; i < sourceSymbolKeys.length; i++) { key = sourceSymbolKeys[i]; if (excluded.indexOf(key) >= 0) continue; if (!Object.prototype.propertyIsEnumerable.call(source, key)) continue; target[key] = source[key]; } } return target; }\n\nfunction _objectWithoutPropertiesLoose(source, excluded) { if (source == null) return {}; var target = {}; var sourceKeys = Object.keys(source); var key, i; for (i = 0; i < sourceKeys.length; i++) { key = sourceKeys[i]; if (excluded.indexOf(key) >= 0) continue; target[key] = source[key]; } return target; }\n\n/* @jsxRuntime classic */\n\n/* @jsx mdx */\nvar _frontmatter = {\n  \"title\": \"Getting Started\",\n  \"chapter\": 1,\n  \"publish\": \"2022-06-18\",\n  \"update\": \"2022-06-18\",\n  \"hero_image\": \"./media/getting_started.png\",\n  \"hero_alt\": \"Alt text from mdx.\",\n  \"author\": \"Rho Lall\",\n  \"keywords\": \"\",\n  \"short\": \"\\nStart here.\\n\"\n};\nvar layoutProps = {\n  _frontmatter: _frontmatter\n};\nvar MDXLayout = \"wrapper\";\nreturn function MDXContent(_ref) {\n  var components = _ref.components,\n      props = _objectWithoutProperties(_ref, _excluded);\n\n  return mdx(MDXLayout, _extends({}, layoutProps, props, {\n    components: components,\n    mdxType: \"MDXLayout\"\n  }), mdx(\"h2\", {\n    \"id\": \"a-note-to-special-educators\",\n    \"style\": {\n      \"position\": \"relative\"\n    }\n  }, mdx(\"a\", {\n    parentName: \"h2\",\n    \"href\": \"#a-note-to-special-educators\",\n    \"aria-label\": \"a note to special educators permalink\",\n    \"className\": \"anchor before\"\n  }, mdx(\"svg\", {\n    parentName: \"a\",\n    \"aria-hidden\": \"true\",\n    \"focusable\": \"false\",\n    \"height\": \"16\",\n    \"version\": \"1.1\",\n    \"viewBox\": \"0 0 16 16\",\n    \"width\": \"16\"\n  }, mdx(\"path\", {\n    parentName: \"svg\",\n    \"fillRule\": \"evenodd\",\n    \"d\": \"M4 9h1v1H4c-1.5 0-3-1.69-3-3.5S2.55 3 4 3h4c1.45 0 3 1.69 3 3.5 0 1.41-.91 2.72-2 3.25V8.59c.58-.45 1-1.27 1-2.09C10 5.22 8.98 4 8 4H4c-.98 0-2 1.22-2 2.5S3 9 4 9zm9-3h-1v1h1c1 0 2 1.22 2 2.5S13.98 12 13 12H9c-.98 0-2-1.22-2-2.5 0-.83.42-1.64 1-2.09V6.25c-1.09.53-2 1.84-2 3.25C6 11.31 7.55 13 9 13h4c1.45 0 3-1.69 3-3.5S14.5 6 13 6z\"\n  }))), \"A note to special educators.\"), mdx(\"p\", null, \"If emotions are under control on both sides, you will find it easier to work with parents, who learn the law. These parents want their children to learn. They want you to succeed. When parents document events and agreements, help their teams stay on task, and build strong working relationships with school personnel, everyone wins. Especially the children.\"), mdx(\"h2\", {\n    \"id\": \"a-good-education-is-the-most-important-gift-you-can-give-your-child\",\n    \"style\": {\n      \"position\": \"relative\"\n    }\n  }, mdx(\"a\", {\n    parentName: \"h2\",\n    \"href\": \"#a-good-education-is-the-most-important-gift-you-can-give-your-child\",\n    \"aria-label\": \"a good education is the most important gift you can give your child permalink\",\n    \"className\": \"anchor before\"\n  }, mdx(\"svg\", {\n    parentName: \"a\",\n    \"aria-hidden\": \"true\",\n    \"focusable\": \"false\",\n    \"height\": \"16\",\n    \"version\": \"1.1\",\n    \"viewBox\": \"0 0 16 16\",\n    \"width\": \"16\"\n  }, mdx(\"path\", {\n    parentName: \"svg\",\n    \"fillRule\": \"evenodd\",\n    \"d\": \"M4 9h1v1H4c-1.5 0-3-1.69-3-3.5S2.55 3 4 3h4c1.45 0 3 1.69 3 3.5 0 1.41-.91 2.72-2 3.25V8.59c.58-.45 1-1.27 1-2.09C10 5.22 8.98 4 8 4H4c-.98 0-2 1.22-2 2.5S3 9 4 9zm9-3h-1v1h1c1 0 2 1.22 2 2.5S13.98 12 13 12H9c-.98 0-2-1.22-2-2.5 0-.83.42-1.64 1-2.09V6.25c-1.09.53-2 1.84-2 3.25C6 11.31 7.55 13 9 13h4c1.45 0 3-1.69 3-3.5S14.5 6 13 6z\"\n  }))), \"A good education, is the most important gift you can give your child.\"), mdx(\"p\", null, \"As a parent of a child with the disability, you have two goals. One to ensure the school provides your child with \", mdx(\"strong\", {\n    parentName: \"p\"\n  }, \"a free appropriate public education\"), \", that includes special education and related services designed to meet your child's unique needs and prepare them for further education, employment, and independent living. Second, to build a healthy working relationship with school personnel. \"), mdx(\"h3\", {\n    \"id\": \"step-one-request-to-have-your-child-tested-for-an-iep\",\n    \"style\": {\n      \"position\": \"relative\"\n    }\n  }, mdx(\"a\", {\n    parentName: \"h3\",\n    \"href\": \"#step-one-request-to-have-your-child-tested-for-an-iep\",\n    \"aria-label\": \"step one request to have your child tested for an iep permalink\",\n    \"className\": \"anchor before\"\n  }, mdx(\"svg\", {\n    parentName: \"a\",\n    \"aria-hidden\": \"true\",\n    \"focusable\": \"false\",\n    \"height\": \"16\",\n    \"version\": \"1.1\",\n    \"viewBox\": \"0 0 16 16\",\n    \"width\": \"16\"\n  }, mdx(\"path\", {\n    parentName: \"svg\",\n    \"fillRule\": \"evenodd\",\n    \"d\": \"M4 9h1v1H4c-1.5 0-3-1.69-3-3.5S2.55 3 4 3h4c1.45 0 3 1.69 3 3.5 0 1.41-.91 2.72-2 3.25V8.59c.58-.45 1-1.27 1-2.09C10 5.22 8.98 4 8 4H4c-.98 0-2 1.22-2 2.5S3 9 4 9zm9-3h-1v1h1c1 0 2 1.22 2 2.5S13.98 12 13 12H9c-.98 0-2-1.22-2-2.5 0-.83.42-1.64 1-2.09V6.25c-1.09.53-2 1.84-2 3.25C6 11.31 7.55 13 9 13h4c1.45 0 3-1.69 3-3.5S14.5 6 13 6z\"\n  }))), \"Step One. Request to have your child tested for an IEP.\"), mdx(\"p\", null, \"The school needs to get your written permission to test your child. At the very least you will need to sign a release. There could be other documents you need to fill out as well. Ask for copies of everything.\"), mdx(\"p\", null, \"If you get pushback from the front desk, just ask them for the documents that you need to fill out so you can get started on them.\"), mdx(\"h3\", {\n    \"id\": \"step-two-your-child-gets-tested-you-want-to-have-independent-evaluations-done-as-well\",\n    \"style\": {\n      \"position\": \"relative\"\n    }\n  }, mdx(\"a\", {\n    parentName: \"h3\",\n    \"href\": \"#step-two-your-child-gets-tested-you-want-to-have-independent-evaluations-done-as-well\",\n    \"aria-label\": \"step two your child gets tested you want to have independent evaluations done as well permalink\",\n    \"className\": \"anchor before\"\n  }, mdx(\"svg\", {\n    parentName: \"a\",\n    \"aria-hidden\": \"true\",\n    \"focusable\": \"false\",\n    \"height\": \"16\",\n    \"version\": \"1.1\",\n    \"viewBox\": \"0 0 16 16\",\n    \"width\": \"16\"\n  }, mdx(\"path\", {\n    parentName: \"svg\",\n    \"fillRule\": \"evenodd\",\n    \"d\": \"M4 9h1v1H4c-1.5 0-3-1.69-3-3.5S2.55 3 4 3h4c1.45 0 3 1.69 3 3.5 0 1.41-.91 2.72-2 3.25V8.59c.58-.45 1-1.27 1-2.09C10 5.22 8.98 4 8 4H4c-.98 0-2 1.22-2 2.5S3 9 4 9zm9-3h-1v1h1c1 0 2 1.22 2 2.5S13.98 12 13 12H9c-.98 0-2-1.22-2-2.5 0-.83.42-1.64 1-2.09V6.25c-1.09.53-2 1.84-2 3.25C6 11.31 7.55 13 9 13h4c1.45 0 3-1.69 3-3.5S14.5 6 13 6z\"\n  }))), \"Step Two. Your child gets tested. You want to have independent evaluations done as well.\"), mdx(\"h3\", {\n    \"id\": \"step-three-initial-meeting-with-the-school-to-discuss-and-review-the-tests\",\n    \"style\": {\n      \"position\": \"relative\"\n    }\n  }, mdx(\"a\", {\n    parentName: \"h3\",\n    \"href\": \"#step-three-initial-meeting-with-the-school-to-discuss-and-review-the-tests\",\n    \"aria-label\": \"step three initial meeting with the school to discuss and review the tests permalink\",\n    \"className\": \"anchor before\"\n  }, mdx(\"svg\", {\n    parentName: \"a\",\n    \"aria-hidden\": \"true\",\n    \"focusable\": \"false\",\n    \"height\": \"16\",\n    \"version\": \"1.1\",\n    \"viewBox\": \"0 0 16 16\",\n    \"width\": \"16\"\n  }, mdx(\"path\", {\n    parentName: \"svg\",\n    \"fillRule\": \"evenodd\",\n    \"d\": \"M4 9h1v1H4c-1.5 0-3-1.69-3-3.5S2.55 3 4 3h4c1.45 0 3 1.69 3 3.5 0 1.41-.91 2.72-2 3.25V8.59c.58-.45 1-1.27 1-2.09C10 5.22 8.98 4 8 4H4c-.98 0-2 1.22-2 2.5S3 9 4 9zm9-3h-1v1h1c1 0 2 1.22 2 2.5S13.98 12 13 12H9c-.98 0-2-1.22-2-2.5 0-.83.42-1.64 1-2.09V6.25c-1.09.53-2 1.84-2 3.25C6 11.31 7.55 13 9 13h4c1.45 0 3-1.69 3-3.5S14.5 6 13 6z\"\n  }))), \"Step Three. Initial meeting with the school to discuss and review the tests.\"), mdx(\"ul\", null, mdx(\"li\", {\n    parentName: \"ul\"\n  }, \"Understand what the different tests are.\"), mdx(\"li\", {\n    parentName: \"ul\"\n  }, \"Understand the results of the tests.\"), mdx(\"li\", {\n    parentName: \"ul\"\n  }, \"Determine significance of the results, what does this mean for your child?\"), mdx(\"li\", {\n    parentName: \"ul\"\n  }, \"Gather feedback from medical team to identify the child\\u2019s needs.\")), mdx(\"p\", null, \"There might be pushback from the school that the child doesn\\u2019t qualify for an IEP. \"), mdx(\"ul\", null, mdx(\"li\", {\n    parentName: \"ul\"\n  }, \"know the eligibility criteria for an IEP (statutory, regulatory, & case law)\"), mdx(\"li\", {\n    parentName: \"ul\"\n  }, \"what are the local laws, and school board policies?\"), mdx(\"li\", {\n    parentName: \"ul\"\n  }, \"what other pertinent information do you need to know about eligabiilty\")), mdx(\"h3\", {\n    \"id\": \"step-four-what-is-an-iep\",\n    \"style\": {\n      \"position\": \"relative\"\n    }\n  }, mdx(\"a\", {\n    parentName: \"h3\",\n    \"href\": \"#step-four-what-is-an-iep\",\n    \"aria-label\": \"step four what is an iep permalink\",\n    \"className\": \"anchor before\"\n  }, mdx(\"svg\", {\n    parentName: \"a\",\n    \"aria-hidden\": \"true\",\n    \"focusable\": \"false\",\n    \"height\": \"16\",\n    \"version\": \"1.1\",\n    \"viewBox\": \"0 0 16 16\",\n    \"width\": \"16\"\n  }, mdx(\"path\", {\n    parentName: \"svg\",\n    \"fillRule\": \"evenodd\",\n    \"d\": \"M4 9h1v1H4c-1.5 0-3-1.69-3-3.5S2.55 3 4 3h4c1.45 0 3 1.69 3 3.5 0 1.41-.91 2.72-2 3.25V8.59c.58-.45 1-1.27 1-2.09C10 5.22 8.98 4 8 4H4c-.98 0-2 1.22-2 2.5S3 9 4 9zm9-3h-1v1h1c1 0 2 1.22 2 2.5S13.98 12 13 12H9c-.98 0-2-1.22-2-2.5 0-.83.42-1.64 1-2.09V6.25c-1.09.53-2 1.84-2 3.25C6 11.31 7.55 13 9 13h4c1.45 0 3-1.69 3-3.5S14.5 6 13 6z\"\n  }))), \"Step Four. What is an IEP?\"), mdx(\"ul\", null, mdx(\"li\", {\n    parentName: \"ul\"\n  }, \"what to expect in the IEP meeting\"), mdx(\"li\", {\n    parentName: \"ul\"\n  }, \"understand what your role is and what you bring to the table\", mdx(\"ul\", {\n    parentName: \"li\"\n  }, mdx(\"li\", {\n    parentName: \"ul\"\n  }, \"then we can talk about testing, subject matter expertise, project management, etc \"))), mdx(\"li\", {\n    parentName: \"ul\"\n  }, \"what the agenda should be, the purpose of the meeting(s)?\"), mdx(\"li\", {\n    parentName: \"ul\"\n  }, \"How frequently are they going to be held?\")), mdx(\"h3\", {\n    \"id\": \"step-five-managing-your-iep-meeting\",\n    \"style\": {\n      \"position\": \"relative\"\n    }\n  }, mdx(\"a\", {\n    parentName: \"h3\",\n    \"href\": \"#step-five-managing-your-iep-meeting\",\n    \"aria-label\": \"step five managing your iep meeting permalink\",\n    \"className\": \"anchor before\"\n  }, mdx(\"svg\", {\n    parentName: \"a\",\n    \"aria-hidden\": \"true\",\n    \"focusable\": \"false\",\n    \"height\": \"16\",\n    \"version\": \"1.1\",\n    \"viewBox\": \"0 0 16 16\",\n    \"width\": \"16\"\n  }, mdx(\"path\", {\n    parentName: \"svg\",\n    \"fillRule\": \"evenodd\",\n    \"d\": \"M4 9h1v1H4c-1.5 0-3-1.69-3-3.5S2.55 3 4 3h4c1.45 0 3 1.69 3 3.5 0 1.41-.91 2.72-2 3.25V8.59c.58-.45 1-1.27 1-2.09C10 5.22 8.98 4 8 4H4c-.98 0-2 1.22-2 2.5S3 9 4 9zm9-3h-1v1h1c1 0 2 1.22 2 2.5S13.98 12 13 12H9c-.98 0-2-1.22-2-2.5 0-.83.42-1.64 1-2.09V6.25c-1.09.53-2 1.84-2 3.25C6 11.31 7.55 13 9 13h4c1.45 0 3-1.69 3-3.5S14.5 6 13 6z\"\n  }))), \"Step Five. Managing Your IEP Meeting\"), mdx(\"ul\", null, mdx(\"li\", {\n    parentName: \"ul\"\n  }, \"preparing for your first IEP meeting\"), mdx(\"li\", {\n    parentName: \"ul\"\n  }, \"project management\"), mdx(\"li\", {\n    parentName: \"ul\"\n  }, \"RACI Matrix\"), mdx(\"li\", {\n    parentName: \"ul\"\n  }, \"SMART IEP Goals and OKRs\")), mdx(\"h1\", {\n    \"id\": \"getting-started\",\n    \"style\": {\n      \"position\": \"relative\"\n    }\n  }, mdx(\"a\", {\n    parentName: \"h1\",\n    \"href\": \"#getting-started\",\n    \"aria-label\": \"getting started permalink\",\n    \"className\": \"anchor before\"\n  }, mdx(\"svg\", {\n    parentName: \"a\",\n    \"aria-hidden\": \"true\",\n    \"focusable\": \"false\",\n    \"height\": \"16\",\n    \"version\": \"1.1\",\n    \"viewBox\": \"0 0 16 16\",\n    \"width\": \"16\"\n  }, mdx(\"path\", {\n    parentName: \"svg\",\n    \"fillRule\": \"evenodd\",\n    \"d\": \"M4 9h1v1H4c-1.5 0-3-1.69-3-3.5S2.55 3 4 3h4c1.45 0 3 1.69 3 3.5 0 1.41-.91 2.72-2 3.25V8.59c.58-.45 1-1.27 1-2.09C10 5.22 8.98 4 8 4H4c-.98 0-2 1.22-2 2.5S3 9 4 9zm9-3h-1v1h1c1 0 2 1.22 2 2.5S13.98 12 13 12H9c-.98 0-2-1.22-2-2.5 0-.83.42-1.64 1-2.09V6.25c-1.09.53-2 1.84-2 3.25C6 11.31 7.55 13 9 13h4c1.45 0 3-1.69 3-3.5S14.5 6 13 6z\"\n  }))), \"Getting Started\"), mdx(\"h2\", {\n    \"id\": \"breath\",\n    \"style\": {\n      \"position\": \"relative\"\n    }\n  }, mdx(\"a\", {\n    parentName: \"h2\",\n    \"href\": \"#breath\",\n    \"aria-label\": \"breath permalink\",\n    \"className\": \"anchor before\"\n  }, mdx(\"svg\", {\n    parentName: \"a\",\n    \"aria-hidden\": \"true\",\n    \"focusable\": \"false\",\n    \"height\": \"16\",\n    \"version\": \"1.1\",\n    \"viewBox\": \"0 0 16 16\",\n    \"width\": \"16\"\n  }, mdx(\"path\", {\n    parentName: \"svg\",\n    \"fillRule\": \"evenodd\",\n    \"d\": \"M4 9h1v1H4c-1.5 0-3-1.69-3-3.5S2.55 3 4 3h4c1.45 0 3 1.69 3 3.5 0 1.41-.91 2.72-2 3.25V8.59c.58-.45 1-1.27 1-2.09C10 5.22 8.98 4 8 4H4c-.98 0-2 1.22-2 2.5S3 9 4 9zm9-3h-1v1h1c1 0 2 1.22 2 2.5S13.98 12 13 12H9c-.98 0-2-1.22-2-2.5 0-.83.42-1.64 1-2.09V6.25c-1.09.53-2 1.84-2 3.25C6 11.31 7.55 13 9 13h4c1.45 0 3-1.69 3-3.5S14.5 6 13 6z\"\n  }))), \"Breath\"), mdx(\"p\", null, \"By many accounts parents describe negotiating with this school as a frustrating exhausting ordeal. Some parents throw in the towel. Others prevail. What is the secret to success?\"), mdx(\"ul\", null, mdx(\"li\", {\n    parentName: \"ul\"\n  }, \"Research\"), mdx(\"li\", {\n    parentName: \"ul\"\n  }, \"Planning\"), mdx(\"li\", {\n    parentName: \"ul\"\n  }, \"Preparation\")), mdx(\"p\", null, \"In the beginning, it is normal to feel overwhelmed. Do not allow what's urgent to take priority over what's important. This is going to be a lot to take in. As you come across new todo items just add them to your list. Remember to breath.\"), mdx(\"p\", null, \"Success comes from knowing what's important and what isn't. Know what issues make parent-school conflict inevitable. Know what's worth fighting for. And what isn\\u2019t. The key is knowledge and skills. \"), mdx(\"h2\", {\n    \"id\": \"the-three-hats-you-wear\",\n    \"style\": {\n      \"position\": \"relative\"\n    }\n  }, mdx(\"a\", {\n    parentName: \"h2\",\n    \"href\": \"#the-three-hats-you-wear\",\n    \"aria-label\": \"the three hats you wear permalink\",\n    \"className\": \"anchor before\"\n  }, mdx(\"svg\", {\n    parentName: \"a\",\n    \"aria-hidden\": \"true\",\n    \"focusable\": \"false\",\n    \"height\": \"16\",\n    \"version\": \"1.1\",\n    \"viewBox\": \"0 0 16 16\",\n    \"width\": \"16\"\n  }, mdx(\"path\", {\n    parentName: \"svg\",\n    \"fillRule\": \"evenodd\",\n    \"d\": \"M4 9h1v1H4c-1.5 0-3-1.69-3-3.5S2.55 3 4 3h4c1.45 0 3 1.69 3 3.5 0 1.41-.91 2.72-2 3.25V8.59c.58-.45 1-1.27 1-2.09C10 5.22 8.98 4 8 4H4c-.98 0-2 1.22-2 2.5S3 9 4 9zm9-3h-1v1h1c1 0 2 1.22 2 2.5S13.98 12 13 12H9c-.98 0-2-1.22-2-2.5 0-.83.42-1.64 1-2.09V6.25c-1.09.53-2 1.84-2 3.25C6 11.31 7.55 13 9 13h4c1.45 0 3-1.69 3-3.5S14.5 6 13 6z\"\n  }))), \"The three hats you wear\"), mdx(\"p\", null, \"As a parent there are three main hats you will wear: subject mater expert, advocate, & project manager.\"), mdx(\"p\", null, mdx(\"strong\", {\n    parentName: \"p\"\n  }, \"Subject Matter Expert.\"), \" Learn about your child's ADHD and how ADHD affects your child's ability to learn. How does it affect your child specifically: their learning, appropriate educational remediation techniques, measuring educational progress, & writing effective goals for IEPs. Learn the laws that apply to your child situation. There is statutory, regulatory, & case law that you will need to know. \"), mdx(\"p\", null, mdx(\"strong\", {\n    parentName: \"p\"\n  }, \"You are the natural advocate for your child.\"), \" There are different types of advocates: lay advocates, educational, advocates, school personnel, and parents. Lay advocates use their specialized knowledge and expertise to help parents resolve problems with schools. Educational advocates evaluate children with disabilities and make recommendations about services. When educational advocates go to eligibility and IEP meetings they are acting on the child's behalf. Parents parents are natural advocates for their children.\"), mdx(\"p\", null, \"Who is your child's first teacher?\"), mdx(\"p\", null, \"You are. \"), mdx(\"p\", null, \"Who is your child's most important role model?\"), mdx(\"p\", null, \"You are. \"), mdx(\"p\", null, \"Who is responsible for your child's welfare?\"), mdx(\"p\", null, \"You are.\"), mdx(\"p\", null, \"Who has your child's best interests at heart?\"), mdx(\"p\", null, \"You do.\"), mdx(\"p\", null, \"I bring a perspective on advocacy that comes from working in social work, as a case manager for over four years. In that time I had the opportunity to aggressively advocate on behalf of my clients. My hope is I can leverage that experience here.\"), mdx(\"p\", null, mdx(\"strong\", {\n    parentName: \"p\"\n  }, \"Project management.\"), \" Project-Managers plan, organize, monitor, and ensure the project gets to completion. I come from a culture of rigorous project management; a results based focus on getting stuff done. My hope is to share what I\\u2019ve learned training and working with truely fantastic project managers.\"), mdx(\"h2\", {\n    \"id\": \"summary\",\n    \"style\": {\n      \"position\": \"relative\"\n    }\n  }, mdx(\"a\", {\n    parentName: \"h2\",\n    \"href\": \"#summary\",\n    \"aria-label\": \"summary permalink\",\n    \"className\": \"anchor before\"\n  }, mdx(\"svg\", {\n    parentName: \"a\",\n    \"aria-hidden\": \"true\",\n    \"focusable\": \"false\",\n    \"height\": \"16\",\n    \"version\": \"1.1\",\n    \"viewBox\": \"0 0 16 16\",\n    \"width\": \"16\"\n  }, mdx(\"path\", {\n    parentName: \"svg\",\n    \"fillRule\": \"evenodd\",\n    \"d\": \"M4 9h1v1H4c-1.5 0-3-1.69-3-3.5S2.55 3 4 3h4c1.45 0 3 1.69 3 3.5 0 1.41-.91 2.72-2 3.25V8.59c.58-.45 1-1.27 1-2.09C10 5.22 8.98 4 8 4H4c-.98 0-2 1.22-2 2.5S3 9 4 9zm9-3h-1v1h1c1 0 2 1.22 2 2.5S13.98 12 13 12H9c-.98 0-2-1.22-2-2.5 0-.83.42-1.64 1-2.09V6.25c-1.09.53-2 1.84-2 3.25C6 11.31 7.55 13 9 13h4c1.45 0 3-1.69 3-3.5S14.5 6 13 6z\"\n  }))), \"Summary\"), mdx(\"p\", null, \"There are certain steps that you need to take. It\\u2019s easy to get overwhelmed. Just take it a step at a time and breath. \"), mdx(\"ul\", null, mdx(\"li\", {\n    parentName: \"ul\"\n  }, \"Request to have your child tested for an IEP. \"), mdx(\"li\", {\n    parentName: \"ul\"\n  }, \"Your child gets tested. You want to have independent evaluations done as well.\"), mdx(\"li\", {\n    parentName: \"ul\"\n  }, \"Initial meeting with the school to discuss and review the tests.\"), mdx(\"li\", {\n    parentName: \"ul\"\n  }, \"What is an IEP?\"), mdx(\"li\", {\n    parentName: \"ul\"\n  }, \"Managing Your IEP Meeting\")), mdx(\"p\", null, \"In addition to taking these initial steps there are three key roles that you as a parent play as part of the IEP team:\"), mdx(\"ul\", null, mdx(\"li\", {\n    parentName: \"ul\"\n  }, \"advocate\"), mdx(\"li\", {\n    parentName: \"ul\"\n  }, \"subject matter expert\"), mdx(\"li\", {\n    parentName: \"ul\"\n  }, \"project manager\")), mdx(\"p\", null, \"The secret to success is preparation. Do your own research. Plan. Stay organized. You are well on your way.\"));\n}\n;\nMDXContent.isMDXComponent = true;","tableOfContents":{"items":[{"items":[{"url":"#a-note-to-special-educators","title":"A note to special educators."},{"url":"#a-good-education-is-the-most-important-gift-you-can-give-your-child","title":"A good education, is the most important gift you can give your child.","items":[{"url":"#step-one-request-to-have-your-child-tested-for-an-iep","title":"Step One. Request to have your child tested for an IEP."},{"url":"#step-two-your-child-gets-tested-you-want-to-have-independent-evaluations-done-as-well","title":"Step Two. Your child gets tested. You want to have independent evaluations done as well."},{"url":"#step-three-initial-meeting-with-the-school-to-discuss-and-review-the-tests","title":"Step Three. Initial meeting with the school to discuss and review the tests."},{"url":"#step-four-what-is-an-iep","title":"Step Four. What is an IEP?"},{"url":"#step-five-managing-your-iep-meeting","title":"Step Five. Managing Your IEP Meeting"}]}]},{"url":"#getting-started","title":"Getting Started","items":[{"url":"#breath","title":"Breath"},{"url":"#the-three-hats-you-wear","title":"The three hats you wear"},{"url":"#summary","title":"Summary"}]}]}}},"pageContext":{"id":"4818f7d0-b85a-505c-b1bd-f12746a200a4","slug":"getting-started","__params":{"slug":"getting-started"}}},"staticQueryHashes":["2940230738","3649515864","63159454"]}