{"componentChunkName":"component---src-pages-accomodations-for-students-with-adhd-mdx-slug-js","path":"/accomodations-for-students-with-adhd/get-organized/","result":{"data":{"mdx":{"frontmatter":{"title":"Get Organized: Tips for the Busy Parent","chapter":210,"keywords":"accommodations for adhd, accommodations for students with adhd, accommodations for adhd elementary students","publish":"June 18, 2022","update":"June 18, 2022","short":"\nStart here.\n"},"slug":"get-organized","body":"var _excluded = [\"components\"];\n\nfunction _extends() { _extends = Object.assign ? Object.assign.bind() : function (target) { for (var i = 1; i < arguments.length; i++) { var source = arguments[i]; for (var key in source) { if (Object.prototype.hasOwnProperty.call(source, key)) { target[key] = source[key]; } } } return target; }; return _extends.apply(this, arguments); }\n\nfunction _objectWithoutProperties(source, excluded) { if (source == null) return {}; var target = _objectWithoutPropertiesLoose(source, excluded); var key, i; if (Object.getOwnPropertySymbols) { var sourceSymbolKeys = Object.getOwnPropertySymbols(source); for (i = 0; i < sourceSymbolKeys.length; i++) { key = sourceSymbolKeys[i]; if (excluded.indexOf(key) >= 0) continue; if (!Object.prototype.propertyIsEnumerable.call(source, key)) continue; target[key] = source[key]; } } return target; }\n\nfunction _objectWithoutPropertiesLoose(source, excluded) { if (source == null) return {}; var target = {}; var sourceKeys = Object.keys(source); var key, i; for (i = 0; i < sourceKeys.length; i++) { key = sourceKeys[i]; if (excluded.indexOf(key) >= 0) continue; target[key] = source[key]; } return target; }\n\n/* @jsxRuntime classic */\n\n/* @jsx mdx */\nvar _frontmatter = {\n  \"title\": \"Get Organized: Tips for the Busy Parent\",\n  \"chapter\": 210,\n  \"publish\": \"2022-06-18\",\n  \"update\": \"2022-06-18\",\n  \"hero_image\": \"./media/getting_started.png\",\n  \"hero_alt\": \"Alt text from mdx.\",\n  \"author\": \"Rho Lall\",\n  \"keywords\": \"accommodations for adhd, accommodations for students with adhd, accommodations for adhd elementary students\",\n  \"short\": \"\\nStart here.\\n\"\n};\nvar layoutProps = {\n  _frontmatter: _frontmatter\n};\nvar MDXLayout = \"wrapper\";\nreturn function MDXContent(_ref) {\n  var components = _ref.components,\n      props = _objectWithoutProperties(_ref, _excluded);\n\n  return mdx(MDXLayout, _extends({}, layoutProps, props, {\n    components: components,\n    mdxType: \"MDXLayout\"\n  }), mdx(\"p\", null, \"The second critical thing you need to do after you request your child be tested for ADHD is to get organized. Half the battle is already won through organization and preparation. This isn't a prerequisite to the work at hand . . . this is the work at hand. \"), mdx(\"p\", null, mdx(\"a\", {\n    parentName: \"p\",\n    \"href\": \"\"\n  }, \"Accommodations for ADHD\"), \" can make all the difference in your child's success at school. But between work, home life, and everything else on your plate, it can be tough to stay organized and on top of everything. Having documentation at your fingertips is vital. Start early. You want to get organized and stay organized. \"), mdx(\"p\", null, \"IEPs are by nature short-term. An advantage of organizing your information is to get the whole picture of everything, you'll be able to see where to focus and what to fight for. In \", mdx(\"a\", {\n    parentName: \"p\",\n    \"href\": \"\"\n  }, \"Developing Page One\"), \" I'll take you through a tool that will help you do just that. Preparedness and organization give your child and IEP team the greatest chance of success.\"), mdx(\"h2\", {\n    \"id\": \"bulletproof-document-management\",\n    \"style\": {\n      \"position\": \"relative\"\n    }\n  }, mdx(\"a\", {\n    parentName: \"h2\",\n    \"href\": \"#bulletproof-document-management\",\n    \"aria-label\": \"bulletproof document management permalink\",\n    \"className\": \"anchor before\"\n  }, mdx(\"svg\", {\n    parentName: \"a\",\n    \"aria-hidden\": \"true\",\n    \"focusable\": \"false\",\n    \"height\": \"16\",\n    \"version\": \"1.1\",\n    \"viewBox\": \"0 0 16 16\",\n    \"width\": \"16\"\n  }, mdx(\"path\", {\n    parentName: \"svg\",\n    \"fillRule\": \"evenodd\",\n    \"d\": \"M4 9h1v1H4c-1.5 0-3-1.69-3-3.5S2.55 3 4 3h4c1.45 0 3 1.69 3 3.5 0 1.41-.91 2.72-2 3.25V8.59c.58-.45 1-1.27 1-2.09C10 5.22 8.98 4 8 4H4c-.98 0-2 1.22-2 2.5S3 9 4 9zm9-3h-1v1h1c1 0 2 1.22 2 2.5S13.98 12 13 12H9c-.98 0-2-1.22-2-2.5 0-.83.42-1.64 1-2.09V6.25c-1.09.53-2 1.84-2 3.25C6 11.31 7.55 13 9 13h4c1.45 0 3-1.69 3-3.5S14.5 6 13 6z\"\n  }))), \"BulletProof Document Management\"), mdx(\"p\", null, \"Get a three-ring binder for all of your child's school-related papers, and make sure to keep everything related to their ADHD and education in it. This covers notes from the doctor, assessment findings, and email conversations among other things.\"), mdx(\"p\", null, \"Keep everything chronological by dating it with a pencil (you may need to erase later). Make copies instead of writing on originals, then take notes on a sticky note linked to the document. Organize all of the papers in chronological sequence. When you hole punch, be careful not to damage significant dates or signatures.\"), mdx(\"p\", null, \"After they've been dated, file your papers. Don't fall into the trap of reading them! Begin with the first document and work your way through each record in sequence. Make a note on a separate sheet of paper of the date, document name, and what it is: email, evaluation, letter, etc.\"), mdx(\"p\", null, \"You may want to group your documents together by putting all emails in one place and all assessments in another. However, resist the urge! Imagine receiving an assessment from the doctor through email. Would you file it under 'assessments,' 'email,' or under the Doctor's name?\"), mdx(\"p\", null, \"You can also make categories in the index. Simply start a list of the tags you want to use to categorize each record. Turn to the next page in your records and add the second row to your index. Include a record for every document in your file. Now, when you need to find something, consult your index. \"), mdx(\"p\", null, mdx(\"strong\", {\n    parentName: \"p\"\n  }, \"Four Rules for Organizing Your File\")), mdx(\"ul\", null, mdx(\"li\", {\n    parentName: \"ul\"\n  }, mdx(\"p\", {\n    parentName: \"li\"\n  }, \"Do not write on original documents\")), mdx(\"li\", {\n    parentName: \"ul\"\n  }, mdx(\"p\", {\n    parentName: \"li\"\n  }, \"Do not use marker or highlighter on your original documents\")), mdx(\"li\", {\n    parentName: \"ul\"\n  }, mdx(\"p\", {\n    parentName: \"li\"\n  }, \"Do not release your original documents to anyone\")), mdx(\"li\", {\n    parentName: \"ul\"\n  }, mdx(\"p\", {\n    parentName: \"li\"\n  }, \"Keep your binder current\"))), mdx(\"h2\", {\n    \"id\": \"request-your-childs-records\",\n    \"style\": {\n      \"position\": \"relative\"\n    }\n  }, mdx(\"a\", {\n    parentName: \"h2\",\n    \"href\": \"#request-your-childs-records\",\n    \"aria-label\": \"request your childs records permalink\",\n    \"className\": \"anchor before\"\n  }, mdx(\"svg\", {\n    parentName: \"a\",\n    \"aria-hidden\": \"true\",\n    \"focusable\": \"false\",\n    \"height\": \"16\",\n    \"version\": \"1.1\",\n    \"viewBox\": \"0 0 16 16\",\n    \"width\": \"16\"\n  }, mdx(\"path\", {\n    parentName: \"svg\",\n    \"fillRule\": \"evenodd\",\n    \"d\": \"M4 9h1v1H4c-1.5 0-3-1.69-3-3.5S2.55 3 4 3h4c1.45 0 3 1.69 3 3.5 0 1.41-.91 2.72-2 3.25V8.59c.58-.45 1-1.27 1-2.09C10 5.22 8.98 4 8 4H4c-.98 0-2 1.22-2 2.5S3 9 4 9zm9-3h-1v1h1c1 0 2 1.22 2 2.5S13.98 12 13 12H9c-.98 0-2-1.22-2-2.5 0-.83.42-1.64 1-2.09V6.25c-1.09.53-2 1.84-2 3.25C6 11.31 7.55 13 9 13h4c1.45 0 3-1.69 3-3.5S14.5 6 13 6z\"\n  }))), \"Request Your Child's Records\"), mdx(\"p\", null, \"Keep track of everyone who may have knowledge or documents regarding your child, and send each a letter asking for copies of what they have. Make sure to explain that you're making the request in response to a school concern and that you need all the information to provide an appropriate education for your kid.\"), mdx(\"p\", null, \"Obtain your child's entire academic and confidential records from their school by contacting the principal and special education director. You may be charged a fee for this request.\"), mdx(\"h2\", {\n    \"id\": \"see-the-big-picture\",\n    \"style\": {\n      \"position\": \"relative\"\n    }\n  }, mdx(\"a\", {\n    parentName: \"h2\",\n    \"href\": \"#see-the-big-picture\",\n    \"aria-label\": \"see the big picture permalink\",\n    \"className\": \"anchor before\"\n  }, mdx(\"svg\", {\n    parentName: \"a\",\n    \"aria-hidden\": \"true\",\n    \"focusable\": \"false\",\n    \"height\": \"16\",\n    \"version\": \"1.1\",\n    \"viewBox\": \"0 0 16 16\",\n    \"width\": \"16\"\n  }, mdx(\"path\", {\n    parentName: \"svg\",\n    \"fillRule\": \"evenodd\",\n    \"d\": \"M4 9h1v1H4c-1.5 0-3-1.69-3-3.5S2.55 3 4 3h4c1.45 0 3 1.69 3 3.5 0 1.41-.91 2.72-2 3.25V8.59c.58-.45 1-1.27 1-2.09C10 5.22 8.98 4 8 4H4c-.98 0-2 1.22-2 2.5S3 9 4 9zm9-3h-1v1h1c1 0 2 1.22 2 2.5S13.98 12 13 12H9c-.98 0-2-1.22-2-2.5 0-.83.42-1.64 1-2.09V6.25c-1.09.53-2 1.84-2 3.25C6 11.31 7.55 13 9 13h4c1.45 0 3-1.69 3-3.5S14.5 6 13 6z\"\n  }))), \"See the BIG Picture\"), mdx(\"p\", null, \"When you read the records chronologically you will see the big picture. Usually, reports are written and filed away never to be read again. Few people take the time to review this information. Because no one sees the big picture plans are short-sighted.\"), mdx(\"p\", null, \"It doesn't have to be a daunting experience to organize your paperwork. You may make it much simpler to discover what you need when you need it by creating an index. The index will give you a quick overview of the topics covered in your file as well as how many documents pertain to each topic. You will be able to work more efficiently and effectively if your file is well-organized. So, take some time now to create an index for your papers. You'll be happy you did!\"), mdx(\"h2\", {\n    \"id\": \"what-do-i-include-in-the-file\",\n    \"style\": {\n      \"position\": \"relative\"\n    }\n  }, mdx(\"a\", {\n    parentName: \"h2\",\n    \"href\": \"#what-do-i-include-in-the-file\",\n    \"aria-label\": \"what do i include in the file permalink\",\n    \"className\": \"anchor before\"\n  }, mdx(\"svg\", {\n    parentName: \"a\",\n    \"aria-hidden\": \"true\",\n    \"focusable\": \"false\",\n    \"height\": \"16\",\n    \"version\": \"1.1\",\n    \"viewBox\": \"0 0 16 16\",\n    \"width\": \"16\"\n  }, mdx(\"path\", {\n    parentName: \"svg\",\n    \"fillRule\": \"evenodd\",\n    \"d\": \"M4 9h1v1H4c-1.5 0-3-1.69-3-3.5S2.55 3 4 3h4c1.45 0 3 1.69 3 3.5 0 1.41-.91 2.72-2 3.25V8.59c.58-.45 1-1.27 1-2.09C10 5.22 8.98 4 8 4H4c-.98 0-2 1.22-2 2.5S3 9 4 9zm9-3h-1v1h1c1 0 2 1.22 2 2.5S13.98 12 13 12H9c-.98 0-2-1.22-2-2.5 0-.83.42-1.64 1-2.09V6.25c-1.09.53-2 1.84-2 3.25C6 11.31 7.55 13 9 13h4c1.45 0 3-1.69 3-3.5S14.5 6 13 6z\"\n  }))), \"What Do I Include In the File\"), mdx(\"p\", null, \"All of it! If a school doesn't have accurate, precise information about your child, how can they make sound judgments? \"), mdx(\"p\", null, \"You may obtain a full copy of your child's entire educational record, including medical records, special education papers, formal and informal correspondence, discipline records, tests, evaluations, and teacher-to-teacher notes. You don't want a spreadsheet with test scores; ask for the actual graded assessment. There might be a charge and a policy concerning copies.\"), mdx(\"p\", null, \"Schools keep records in different places. Records and reports have been known to get misplaced. Print out every email. Print it all out.\"), mdx(\"h2\", {\n    \"id\": \"sic-vis-pacem-para-bellum\",\n    \"style\": {\n      \"position\": \"relative\"\n    }\n  }, mdx(\"a\", {\n    parentName: \"h2\",\n    \"href\": \"#sic-vis-pacem-para-bellum\",\n    \"aria-label\": \"sic vis pacem para bellum permalink\",\n    \"className\": \"anchor before\"\n  }, mdx(\"svg\", {\n    parentName: \"a\",\n    \"aria-hidden\": \"true\",\n    \"focusable\": \"false\",\n    \"height\": \"16\",\n    \"version\": \"1.1\",\n    \"viewBox\": \"0 0 16 16\",\n    \"width\": \"16\"\n  }, mdx(\"path\", {\n    parentName: \"svg\",\n    \"fillRule\": \"evenodd\",\n    \"d\": \"M4 9h1v1H4c-1.5 0-3-1.69-3-3.5S2.55 3 4 3h4c1.45 0 3 1.69 3 3.5 0 1.41-.91 2.72-2 3.25V8.59c.58-.45 1-1.27 1-2.09C10 5.22 8.98 4 8 4H4c-.98 0-2 1.22-2 2.5S3 9 4 9zm9-3h-1v1h1c1 0 2 1.22 2 2.5S13.98 12 13 12H9c-.98 0-2-1.22-2-2.5 0-.83.42-1.64 1-2.09V6.25c-1.09.53-2 1.84-2 3.25C6 11.31 7.55 13 9 13h4c1.45 0 3-1.69 3-3.5S14.5 6 13 6z\"\n  }))), \"Sic Vis Pacem Para Bellum\"), mdx(\"p\", null, \"Assume that without a hearing to resolve your child's IEP-related difficulties, you will not be able to secure accommodations for ADHD. Assume that the school refuses to provide your child with services. What do you do? \"), mdx(\"p\", null, \"Due process hearings are formal means to resolve special education disputes. A due process hearing is civil litigation. You need evidence and proof in order to win, just like you would in any court proceeding. Your file is your evidence and proof of what has happened. Evidence can include:\"), mdx(\"ul\", null, mdx(\"li\", {\n    parentName: \"ul\"\n  }, mdx(\"p\", {\n    parentName: \"li\"\n  }, \"letters written after meetings\")), mdx(\"li\", {\n    parentName: \"ul\"\n  }, mdx(\"p\", {\n    parentName: \"li\"\n  }, \"notes and transcripts of meetings\")), mdx(\"li\", {\n    parentName: \"ul\"\n  }, mdx(\"p\", {\n    parentName: \"li\"\n  }, \"test scores\")), mdx(\"li\", {\n    parentName: \"ul\"\n  }, mdx(\"p\", {\n    parentName: \"li\"\n  }, \"your journal\")), mdx(\"li\", {\n    parentName: \"ul\"\n  }, mdx(\"p\", {\n    parentName: \"li\"\n  }, \"your contact log of telephone calls\")), mdx(\"li\", {\n    parentName: \"ul\"\n  }, mdx(\"p\", {\n    parentName: \"li\"\n  }, \"reports, evaluations, & observations of your child (by independent experts)\")), mdx(\"li\", {\n    parentName: \"ul\"\n  }, mdx(\"p\", {\n    parentName: \"li\"\n  }, \"research reports\")), mdx(\"li\", {\n    parentName: \"ul\"\n  }, mdx(\"p\", {\n    parentName: \"li\"\n  }, \"newspaper articles\")), mdx(\"li\", {\n    parentName: \"ul\"\n  }, mdx(\"p\", {\n    parentName: \"li\"\n  }, \"school guidelines\")), mdx(\"li\", {\n    parentName: \"ul\"\n  }, mdx(\"p\", {\n    parentName: \"li\"\n  }, \"handbooks\")), mdx(\"li\", {\n    parentName: \"ul\"\n  }, mdx(\"p\", {\n    parentName: \"li\"\n  }, \"publications\")), mdx(\"li\", {\n    parentName: \"ul\"\n  }, mdx(\"p\", {\n    parentName: \"li\"\n  }, \"audits of your school system\"))), mdx(\"p\", null, \"To Avoid Conflict, Prepare for Conflict. Sic vis pacem, para bellum is a latin adage that translates as \\\"If you want peace, prepare for war.\\\" The time to prepare is not when conflict is imminent but rather when times are peaceful. \"), mdx(\"p\", null, \"If you enter a meeting prepared for a due process hearing then you have done your part as an advocate for your child. If you document the meeting and follow up with polite letters you have done your part as an advocate for your child. Anything less than that and you are relying on the school faculty to carry you. They might not. \"), mdx(\"h2\", {\n    \"id\": \"what-do-i-need\",\n    \"style\": {\n      \"position\": \"relative\"\n    }\n  }, mdx(\"a\", {\n    parentName: \"h2\",\n    \"href\": \"#what-do-i-need\",\n    \"aria-label\": \"what do i need permalink\",\n    \"className\": \"anchor before\"\n  }, mdx(\"svg\", {\n    parentName: \"a\",\n    \"aria-hidden\": \"true\",\n    \"focusable\": \"false\",\n    \"height\": \"16\",\n    \"version\": \"1.1\",\n    \"viewBox\": \"0 0 16 16\",\n    \"width\": \"16\"\n  }, mdx(\"path\", {\n    parentName: \"svg\",\n    \"fillRule\": \"evenodd\",\n    \"d\": \"M4 9h1v1H4c-1.5 0-3-1.69-3-3.5S2.55 3 4 3h4c1.45 0 3 1.69 3 3.5 0 1.41-.91 2.72-2 3.25V8.59c.58-.45 1-1.27 1-2.09C10 5.22 8.98 4 8 4H4c-.98 0-2 1.22-2 2.5S3 9 4 9zm9-3h-1v1h1c1 0 2 1.22 2 2.5S13.98 12 13 12H9c-.98 0-2-1.22-2-2.5 0-.83.42-1.64 1-2.09V6.25c-1.09.53-2 1.84-2 3.25C6 11.31 7.55 13 9 13h4c1.45 0 3-1.69 3-3.5S14.5 6 13 6z\"\n  }))), \"What Do I Need?\"), mdx(\"p\", null, \"You prepare by maintaining the file as complete as possible with documentation. You will need:\"), mdx(\"ul\", null, mdx(\"li\", {\n    parentName: \"ul\"\n  }, mdx(\"p\", {\n    parentName: \"li\"\n  }, \"(2) three ring notebooks. One is to organize your child's documents. A second to organize your research to support your subject matter expertise.\")), mdx(\"li\", {\n    parentName: \"ul\"\n  }, mdx(\"p\", {\n    parentName: \"li\"\n  }, \"three-hole punch\")), mdx(\"li\", {\n    parentName: \"ul\"\n  }, mdx(\"p\", {\n    parentName: \"li\"\n  }, \"highlighters\")), mdx(\"li\", {\n    parentName: \"ul\"\n  }, mdx(\"p\", {\n    parentName: \"li\"\n  }, \"sticky notes\")), mdx(\"li\", {\n    parentName: \"ul\"\n  }, mdx(\"p\", {\n    parentName: \"li\"\n  }, \"envelopes\")), mdx(\"li\", {\n    parentName: \"ul\"\n  }, mdx(\"p\", {\n    parentName: \"li\"\n  }, \"stamps\")), mdx(\"li\", {\n    parentName: \"ul\"\n  }, mdx(\"p\", {\n    parentName: \"li\"\n  }, \"calendar\")), mdx(\"li\", {\n    parentName: \"ul\"\n  }, mdx(\"p\", {\n    parentName: \"li\"\n  }, \"journal\")), mdx(\"li\", {\n    parentName: \"ul\"\n  }, mdx(\"p\", {\n    parentName: \"li\"\n  }, \"contact log\")), mdx(\"li\", {\n    parentName: \"ul\"\n  }, mdx(\"p\", {\n    parentName: \"li\"\n  }, \"audio recorder\"))), mdx(\"h2\", {\n    \"id\": \"your-master-plan\",\n    \"style\": {\n      \"position\": \"relative\"\n    }\n  }, mdx(\"a\", {\n    parentName: \"h2\",\n    \"href\": \"#your-master-plan\",\n    \"aria-label\": \"your master plan permalink\",\n    \"className\": \"anchor before\"\n  }, mdx(\"svg\", {\n    parentName: \"a\",\n    \"aria-hidden\": \"true\",\n    \"focusable\": \"false\",\n    \"height\": \"16\",\n    \"version\": \"1.1\",\n    \"viewBox\": \"0 0 16 16\",\n    \"width\": \"16\"\n  }, mdx(\"path\", {\n    parentName: \"svg\",\n    \"fillRule\": \"evenodd\",\n    \"d\": \"M4 9h1v1H4c-1.5 0-3-1.69-3-3.5S2.55 3 4 3h4c1.45 0 3 1.69 3 3.5 0 1.41-.91 2.72-2 3.25V8.59c.58-.45 1-1.27 1-2.09C10 5.22 8.98 4 8 4H4c-.98 0-2 1.22-2 2.5S3 9 4 9zm9-3h-1v1h1c1 0 2 1.22 2 2.5S13.98 12 13 12H9c-.98 0-2-1.22-2-2.5 0-.83.42-1.64 1-2.09V6.25c-1.09.53-2 1.84-2 3.25C6 11.31 7.55 13 9 13h4c1.45 0 3-1.69 3-3.5S14.5 6 13 6z\"\n  }))), \"Your Master Plan\"), mdx(\"p\", null, \"In the next section, I am going to take you through the creation of your \", mdx(\"a\", {\n    parentName: \"p\",\n    \"href\": \"\"\n  }, \"one page OGSP\"), \". One of the three hats you wear is Project Manager: in its highest form, project management is leadership. This is a leader's tool. An OGSP is your tool to lead the IEP team to success. It is a one-page document that includes vital information to help you successfully guide the team to positive outcomes for your child. The OGSP should be filed in the front of your binder, right after the index. \"));\n}\n;\nMDXContent.isMDXComponent = true;","tableOfContents":{"items":[{"url":"#bulletproof-document-management","title":"BulletProof Document Management"},{"url":"#request-your-childs-records","title":"Request Your Child's Records"},{"url":"#see-the-big-picture","title":"See the BIG Picture"},{"url":"#what-do-i-include-in-the-file","title":"What Do I Include In the File"},{"url":"#sic-vis-pacem-para-bellum","title":"Sic Vis Pacem Para Bellum"},{"url":"#what-do-i-need","title":"What Do I Need?"},{"url":"#your-master-plan","title":"Your Master Plan"}]}}},"pageContext":{"id":"bcf7b535-d8f7-52a4-b397-e879e6093a9f","slug":"get-organized","__params":{"slug":"get-organized"}}},"staticQueryHashes":["2940230738","3649515864","63159454"]}